youtube,"Am frühen Morgen hat die Terrororganisation Hamas damit begonnen, Israel massiv anzugreifen - mit Raketen aus dem Gazastreifen, aber auch mit Kämpfern in Israel selbst. Es gibt Tote und Verletzte, darunter auch viele Zivilisten. Was sind die Hintergründe des Terrorangriffs? Darum geht es in diesem Video.

Anmerkung: Leider hat sich bei der Bebilderung der al-Aqsa-Moschee ein Fehler eingeschlichen. Zu sehen ist natürlich nicht die Moschee, sondern der Felsendom, der sich ebenfalls auf dem Tempelberg befindet.

Ein Liveblog zu den Ereignissen in Israel - https://www.zdf.de/nachrichten/politik/israel-palaestinenser-hamas-gewalt-eskalation-liveticker-100.html?at_medium=custom3&at_campaign=194&at_custom1=youtube

Das erwähnte Video zum Nahostkonflikt - https://www.youtube.com/watch?v=IAD_fVFE6y8

... und ein Dossier der Bundeszentrale für politische Bildung zu diesem Thema - https://www.bpb.de/themen/kriege-konflikte/dossier-kriege-konflikte/54655/nahost

Die Geschichte Palästinas von seinen Anfängen bis heute - https://www.lpb-bw.de/geschichte-palaestinas

Israelfeindschaft und Antisemitismus, unter anderem bei der Hamas - https://www.uibk.ac.at/iup/buch_pdfs/antisemitismus/10.1520399106-015-4-07.pdf

Hintergründe zur indirekten Finanzierung der Hamas durch Deutschland - https://www.tagesspiegel.de/politik/wenn-deutsches-steuergeld-antisemitismus-finanziert-8015854.html

► Mein Kanal gehört zu funk, dem Netzwerk von ARD und ZDF. Weitere Infos:

Youtube: http://www.youtube.com/funkofficial
funk Web-App: https://go.funk.net
Impressum: https://go.funk.net/impressum             

Kostenlos abonnieren - http://www.youtube.com/mrwissen2go/?sub_confirmation=1

Hier findet ihr MrWissen2go bei Instagram - http://www.instagram.com/mrwissen2go

Thumbnail-Designer: David Weber

Schnitt & Animationen: Mirko Drotschmann

Design: Christopher Hesse",,1742652,"{'comment_count': '11775', 'like_count': '56870', 'view_count': '1730877'}",MrWissen2go,,2023-10-07 13:29:15,,https://www.youtube.com/watch?v=rjoYPI0hSDk,https://i.ytimg.com/vi/rjoYPI0hSDk/default.jpg
youtube,"Continúan los enfrentamientos armados entre integrantes de Hamas y el Ejército de Israel. Hasta ahora son cerca de mil los objetivos de Hamas atacados por Israel por un intento de aniquilar su capacidad militar.

*-*-*-*-*-*-*-*-*-*-*-*-*-*-*-*-*-*-*-*-*-*-*-*
Suscríbete: https://bit.ly/433V3K9
Shorts: youtube.com/@cnnee/shorts

Nuestro sitio: http://cnne.com/

Únete a WhatsApp Channel: https://cnn.it/486yW9w
Dale a ""Me gusta"" en Facebook: http://Facebook.com/cnnee
Síguenos en Twitter: http://Twitter.com/cnnee
Míranos en Instagram: http://instagram.com/cnnee",,1842912,"{'comment_count': '4375', 'like_count': '20848', 'view_count': '1838537'}",CNN en Español,,2023-10-08 23:17:17,,https://www.youtube.com/watch?v=cUtssIft7Rc,https://i.ytimg.com/vi/cUtssIft7Rc/default.jpg
youtube,"El grupo islamista palestino Hamás lanzó el 7 de octubre el mayor ataque contra Israel en años, matando a decenas de personas e hiriendo a cientos en un asalto sorpresa. En respuesta, Israel adelanta una serie de ataques aéreos en la Franja de Gaza y emitió la orden de movilización de sus reservistas. Nuestros corresponsales Federico Cué Barberena y Janira Gómez Muñoz nos traen todos los detalles.


🔔 Suscriba a nuestra cadena en YouTube: https://f24.my/YTes
🔴 En VIVO - Siga FRANCE 24 aquí: https://f24.my/YTliveES

🌍 Nuestro sitio: https://www.france24.com/es/

Únase a la comunidad Facebook: https://f24.my/FBes
Siganos en X (Twitter): https://f24.my/Xes
Descubre las noticias en imágenes en Instagram: https://f24.my/IGes
Recibe las últimas noticias en Telegram: https://f24.my/TGes",,376315,"{'comment_count': '40', 'like_count': '3194', 'view_count': '376275'}",FRANCE 24 Español,,2023-10-07 13:43:41,,https://www.youtube.com/watch?v=uc5JsAjpQ08,https://i.ytimg.com/vi/uc5JsAjpQ08/default.jpg
youtube,"खबरों को विस्तार से पढ़ने के लिए क्लिक करे यहां- https://www.thelallantop.com/

LT Premium जॉइन करने के लिए नीचे दिए लिंक पर क्लिक करें: https://www.youtube.com/channel/UCx8Z14PpntdaxCt2hakbQLQ/join

In this video, Saurabh Dwivedi explains the Israel Palestine Conflict as the tensions between Israel and Palestine have reached their peak.  Palestinian militants fired several rockets from Gaza. After this, Israeli security forces also carried out strong airstrikes on Philistenian territories. We have explained:

1. Reason behind Israel Palestine War
2. What's the reason behind this fresh violence?
3. What's the history of Temple Mount, called Haram-al-Sharif by Muslims?
4. What's the history of Al-Aqsa mosque and Dome of the Rock?
5. What's Temple Mount?

Why Jerusalem is so dear to Jews, Christians and Muslims? Watch the video to know about it.

Instagram: https://www.instagram.com/thelallantop/
Facebook: https://www.facebook.com/thelallantop/
Twitter: https://twitter.com/TheLallantop

Produced By: The Lallantop
Edited By: Ved Prakash",,4072653,"{'comment_count': '7286', 'like_count': '57163', 'view_count': '4065367'}",The Lallantop,,2023-10-08 09:40:18,,https://www.youtube.com/watch?v=1tsqw1-WCog,https://i.ytimg.com/vi/1tsqw1-WCog/default.jpg
youtube,"#tribuntimur #tribunviral #rusiavsukraina

TRIBUN-TIMUR.COM - Ratusan warga Israel melarikan diri dari sebuah festival keagamaan di padang pasir karena panik saat militan Palestina menyerbu tempat tersebut.
Kepanikan itu tergambar dari tayangan video yang beredar di media sosial.
Tampak pemandangan kekacauan di gurun.
Serangan terhadap festival tersebut terjadi di tengah gelombang serangan mendadak yang dilakukan kelompok militan Palestina ke Israel selatan pada Sabtu (7/10/2023).
Salah satu peserta, bernama Daniel, mengatakan kepada media Israel, mendadak muncul peringatan tanda bahaya serangan.
Warga Israel terlihat berteriak, berlari, dan masuk ke dalam mobil ketika mereka berusaha melarikan diri dari lokasi kejadian.
Rekamanyapun menuai berbagai komentar dari warganet.

Video: Charly
Narator: Ririn

(TRIBUN-TIMUR.COM)
Update info terkini via http://tribun-timur.com/

Follow akun Instagram http://bit.ly/IGTribunTimur
Follow akun Twitter http://bit.ly/twitterTribunTimur
Follow dan like fanpage Facebook http://bit.ly/FBTribunTimurMks
YouTube business inquiries: 081144407111",,477343,"{'comment_count': '2294', 'like_count': '3580', 'view_count': '475049'}",Tribun Timur,,2023-10-08 05:04:21,,https://www.youtube.com/watch?v=qpEaiI-Lzp8,https://i.ytimg.com/vi/qpEaiI-Lzp8/default.jpg
youtube,"Dozens of rockets have been fired at Israel from Gaza in a surprise rocket attack. The rocket fire is still ongoing. And infiltrators from Gaza are attacking Israel on land. Get the latest on the Gaza rockets being fired at Israel and land attack on Israel in our LIVE breaking news coverage.

Rocket alarms have been sounding at a number of locations in Israel. In this interactive live stream, host Steve Lookner brings you the latest updates on the rocket and land attack from Gaza at Israel, and he’ll also read your comments and questions on the air!

Follow us on Twitter!  http://twitter.com/AgendaFreeTV
Follow us on Facebook!  http://www.facebook.com/AgendaFreeTV

Your donations keep us on the air!
Donate at http://agendafree.tv

Or get cool Agenda-Free TV rewards by supporting us on Patreon: http://www.patreon.com/agendafreetv

Don't want to miss a stream? Get notified whenever we’re going live to cover breaking news by signing up for our free Discord notifications!
https://discord.gg/agenda-freetv
(You can also chat in the Discord with other viewers when we’re not on the air!)",,297231,"{'comment_count': '151', 'like_count': '5649', 'view_count': '297080'}",Agenda-Free TV,,2023-10-07 12:12:57,,https://www.youtube.com/watch?v=UEB-fjBQZTg,https://i.ytimg.com/vi/UEB-fjBQZTg/default.jpg
youtube,"The Palestinian group Hamas has launched the biggest attack on Israel in years with many killed, hostages taken, and fighting raging after a surprise assault that included gunmen entering Israeli towns after a barrage of rockets fired from the Gaza Strip. Israel said Hamas has declared war as its army mobilised and air force launched strikes on Gaza with Prime Minister Benjamin Netanyahu promising harsh retaliation. Amid this, Sharukh khan's post on Palestine is viral. Watch the video to know what SRK said on Israel-Palestine war.

Story - https://www.thelallantop.com/entertainment/post/shahrukh-khan-old-tweet-viral-on-israel-palestine-conflict-amidst-hamas-attack

खबरों को विस्तार से पढ़ने के लिए क्लिक करे यहां- https://www.thelallantop.com/

LT Premium जॉइन करने के लिए नीचे दिए लिंक पर क्लिक करें: https://www.youtube.com/channel/UCx8Z14PpntdaxCt2hakbQLQ/join

Instagram: https://www.instagram.com/thelallantop/
Facebook: https://www.facebook.com/thelallantop/
Twitter: https://twitter.com/TheLallantop

Produced By: The Lallantop
Edited By:Pankaj",,654419,"{'comment_count': '3349', 'like_count': '8397', 'view_count': '651070'}",The Lallantop,,2023-10-08 14:48:00,,https://www.youtube.com/watch?v=PIpsUk6Ubow,https://i.ytimg.com/vi/PIpsUk6Ubow/default.jpg
youtube,"Militan Palestina di Jalur Gaza melakukan Operasi Al-Aqsa ke Israel selatan yang belum pernah terjadi sebelumnya pada hari Sabtu, 7 Oktober 2023.


Militer Israel menempatkan negara itu dalam keadaan siaga perang dan mulai menyerang target-target di Gaza sebagai tanggapan, menyiapkan panggung untuk apa yang kemungkinan akan menjadi babak baru pertempuran sengit antara musuh-musuh bebuyutan. 




#tank #israel #gaza


Video Editor: Re",,526067,"{'comment_count': '1816', 'like_count': '4668', 'view_count': '524251'}",Tribun Jateng,,2023-10-07 07:39:48,,https://www.youtube.com/watch?v=NcpwjbgWhok,https://i.ytimg.com/vi/NcpwjbgWhok/default.jpg
youtube,"Palestinian fighters seizing Israeli tanks in Gaza, after launching a surprise military attack against Israel in the early hours of Saturday morning.

Israeli medics have said at least 40 Israelis have been killed and more than 740 wounded since the start of the attack by the Palestinian groups based in Gaza. 

The scale of the assault, which is still ongoing, is unprecedented in nature

Subscribe to our channel: http://ow.ly/AVlW30n1OWH

Middle East Eye Website: https://middleeasteye.net
Follow us on TikTok: https://www.tiktok.com/@middleeasteye
Follow us on Instagram: https://instagram.com/MiddleEastEye
Like us on Facebook: https://facebook.com/MiddleEastEye
Follow us on Twitter: https://twitter.com/MiddleEastEye",,3725750,"{'comment_count': '7877', 'like_count': '88332', 'view_count': '3717873'}",Middle East Eye,,2023-10-07 13:22:40,,https://www.youtube.com/watch?v=e-IpJ5T6IRc,https://i.ytimg.com/vi/e-IpJ5T6IRc/default.jpg
youtube,"El grupo islamista palestino Hamás lanzó el sábado 7 de octubre el mayor ataque contra Israel en años. ¿Cómo logró Hamás coordinar este ataque masivo e infiltrar las defensas israelíes? ¿En qué momento llega la escalada? ¿Cómo responderá Israel? Bryan Acuña, licenciado en relaciones internacionales y experto en Medio Oriente responde los interrogantes y nos amplía el contexto.


🔔 Suscriba a nuestra cadena en YouTube: https://f24.my/YTes
🔴 En VIVO - Siga FRANCE 24 aquí: https://f24.my/YTliveES

🌍 Nuestro sitio: https://www.france24.com/es/

Únase a la comunidad Facebook: https://f24.my/FBes
Siganos en X (Twitter): https://f24.my/Xes
Descubre las noticias en imágenes en Instagram: https://f24.my/IGes
Recibe las últimas noticias en Telegram: https://f24.my/TGes",,1126699,"{'comment_count': '2595', 'like_count': '12908', 'view_count': '1124104'}",FRANCE 24 Español,,2023-10-07 13:47:32,,https://www.youtube.com/watch?v=Ggl01GOueI0,https://i.ytimg.com/vi/Ggl01GOueI0/default.jpg
youtube,"#tribuntimur #tribunviral #israelpalestine 

TRIBUN-TIMUR.COM - Peran Israel-Palestina

 Perdana Menteri Benjamin Netanyahu mengatakan Israel sedang ""berperang"" setelah militan Gaza melancarkan serangan mendadak pada hari Sabtu, menembakkan ribuan roket dan memasuki Israel melalui darat, laut dan udara menggunakan paralayang.  Setidaknya 40 orang tewas dan hampir 800 orang terluka di Israel, kata para pejabat.

(TRIBUN-TIMUR.COM)
Update info terkini via http://tribun-timur.com/

Follow akun Instagram http://bit.ly/IGTribunTimur
Follow akun Twitter http://bit.ly/twitterTribunTimur
Follow dan like fanpage Facebook http://bit.ly/FBTribunTimurMks
YouTube business inquiries: 081144407111",,282049,"{'comment_count': '2217', 'like_count': '2014', 'view_count': '279832'}",Tribun Timur,,2023-10-07 15:31:44,,https://www.youtube.com/watch?v=ne2nZ5HQ1CI,https://i.ytimg.com/vi/ne2nZ5HQ1CI/default.jpg
youtube,"खबरों को विस्तार से पढ़ने के लिए क्लिक करे यहां- https://www.thelallantop.com/

LT Premium जॉइन करने के लिए नीचे दिए लिंक पर क्लिक करें: https://www.youtube.com/channel/UCx8Z14PpntdaxCt2hakbQLQ/join

After Hamas’ attack on Israel, Israeli media and analysts are questioning Mossad’s inability to intercept the situation. More than 600 Israelis have been killed in the attack

Dozens of armed Palestinian gunmen were able to cross the heavily fortified border between Israel and the Gaza Strip, while thousands of rockets were fired from Gaza into Israel. With the combined efforts of Shin Bet, Israeli domestic intelligence, Mossad, its external spy agency and all the assets of the Israel Defense Forces, it is frankly astounding that nobody saw this coming.
Or if they did, they failed to act on it. Israel has arguably the most extensive and well-funded intelligence services in the Middle East.


In this video, You will get to learn;
- Why did Mossad fail in intercepting the attack?
- What did Israeli media write on the intelligence failure?
- And, Where will this failure lead?

Watch the video to know all about these in detail.

#Mosad #Israel #Palestine


Instagram: https://www.instagram.com/thelallantop/
Facebook: https://www.facebook.com/thelallantop/
Twitter: https://twitter.com/TheLallantop

Produced By: The Lallantop
Edited By: Ved Prakash",,1272346,"{'comment_count': '2356', 'like_count': '13881', 'view_count': '1269990'}",The Lallantop,,2023-10-08 13:15:04,,https://www.youtube.com/watch?v=u58iNeqwKRI,https://i.ytimg.com/vi/u58iNeqwKRI/default.jpg
youtube,"खबरों को विस्तार से पढ़ने के लिए क्लिक करे यहां- https://www.thelallantop.com/

LT Premium जॉइन करने के लिए नीचे दिए लिंक पर क्लिक करें: https://www.youtube.com/channel/UCx8Z14PpntdaxCt2hakbQLQ/join

In this video, we explore the multi-faceted aspects of the ongoing conflict in Israel and Palestine. Not only has Hamas launched attacks on Israel, but Hezbollah from Lebanon has also entered the fray. This raises questions about whether the scope of this war could extend beyond Israel and Palestine. Hamas claims that Israeli actions had harmed Al-Aqsa Mosque, but is this the sole reason behind the conflict? We delve into the involvement of various nations in this crisis and the historical significance of Al-Aqsa Mosque or Temple Mount, viewed differently by Jewish and Muslim communities. Understanding the reasons behind this conflict is crucial. On a global scale, Indian Prime Minister Narendra Modi has expressed solidarity with Israel. We also analyze India's historical stance on the Israel-Palestine conflict and how it differs now. Who is provoking Hamas, and who stands alongside them?

Subscribe for more updates and share your thoughts in the comments section below.

Instagram: https://www.instagram.com/thelallantop/
Facebook: https://www.facebook.com/thelallantop/
Twitter: https://twitter.com/TheLallantop

Produced By: The Lallantop
Edited By:Asad",,609864,"{'comment_count': '1083', 'like_count': '7174', 'view_count': '608781'}",The Lallantop,,2023-10-08 18:24:15,,https://www.youtube.com/watch?v=FZnduQ07Dxk,https://i.ytimg.com/vi/FZnduQ07Dxk/default.jpg
youtube,,,461155,"{'comment_count': '1100', 'like_count': '12170', 'view_count': '460055'}",Azteca Noticias,,2023-10-07 23:30:02,,https://www.youtube.com/watch?v=B_H6II5EnyA,https://i.ytimg.com/vi/B_H6II5EnyA/default.jpg
youtube,"Thousands of rockets were fired Saturday morning as Hamas militants in Gaza targeted Israel, prompting Israeli Prime Minister Benjamin Netanyahu to say ""we are at war.""

SUBSCRIBE to ABC News on YouTube: https://bit.ly/2vZb6yP
Latest updates: https://abcnews.go.com/
Watch FULL EPISODES on Hulu: http://abcn.ws/3bzvQQn",,2201076,"{'comment_count': '4731', 'like_count': '44707', 'view_count': '2196345'}",ABC News,,2023-10-07 10:22:49,,https://www.youtube.com/watch?v=SypqedUgvHE,https://i.ytimg.com/vi/SypqedUgvHE/default.jpg
youtube,"Israel battered Palestinians in Gaza on Sunday (Oct 8) after suffering its bloodiest day in decades when Hamas fighters rampaged through Israeli towns, with hundreds killed on both sides. 

The spiraling violence threatens a major new Middle East war.  

Read more at https://tinyurl.com/yc7bhfjr

WATCH MORE: https://thestartv.com/c/news
SUBSCRIBE: https://cutt.ly/TheStar
LIKE: https://fb.com/TheStarOnline",,6683,"{'comment_count': '71', 'like_count': '40', 'view_count': '6612'}",The Star,,2023-10-08 15:02:24,,https://www.youtube.com/watch?v=JEq0rCnz_qw,https://i.ytimg.com/vi/JEq0rCnz_qw/default.jpg
youtube,"Hamas has launched ‘Operation Al-Aqsa Flood’ against Israel – the biggest armed offensive in decades. Videos show Palestinian fighters ‘infiltrating’ Israeli territory from Gaza, by land and air, where they are reported to have captured Israeli soldiers.

Subscribe to our channel  http://bit.ly/AJSubscribe
Follow us on Twitter https://twitter.com/AJEnglish
Find us on Facebook https://www.facebook.com/aljazeera
Check our website:  https://www.aljazeera.com/
Check out our Instagram page: https://www.instagram.com/aljazeeraenglish/
Download AJE Mobile App: https://aje.io/AJEMobile

@AljazeeraEnglish
#Aljazeeraenglish
#News",,1702390,"{'comment_count': '4240', 'like_count': '43241', 'view_count': '1698150'}",Al Jazeera English,,2023-10-07 08:17:25,,https://www.youtube.com/watch?v=M-hRcBItxqs,https://i.ytimg.com/vi/M-hRcBItxqs/default.jpg
youtube,"The Hamas militant group has launched an unprecedented infiltration of Israel, crossing the border on foot, motorbike and apparently by air - with paragliders.

Israel has retaliated with strikes on the Gaza Strip while Prime Minister Benjamin Netanyahu declared the nation ""is at war"".

#Hamas #Israel #Gaza #Conflict #Palestine #GazaStrip #Netanyahu #Shorts

SUBSCRIBE to our YouTube channel for more videos: http://www.youtube.com/skynews 
Follow us on Twitter: https://twitter.com/skynews 
Like us on Facebook: https://www.facebook.com/skynews 
Follow us on Instagram: https://www.instagram.com/skynews 
Follow us on TikTok: https://www.tiktok.com/@skynews 

For more content go to http://news.sky.com and download our apps: Apple https://itunes.apple.com/gb/app/sky-news/id316391924?mt=8 Android https://play.google.com/store/apps/details?id=com.bskyb.skynews.android&hl=en_GB 

Sky News Daily podcast is available for free here: https://podfollow.com/skynewsdaily/ 

Sky News videos are now available in Spanish here/Los video de Sky News están disponibles en español aquí: https://www.youtube.com/channel/UCzG5BnqHO8oNlrPDW9CYJog 

To enquire about licensing Sky News content, you can find more information here: https://news.sky.com/info/library-sales",,389453,"{'comment_count': '602', 'like_count': '7193', 'view_count': '388851'}",Sky News,,2023-10-07 12:20:32,,https://www.youtube.com/watch?v=_UPSU2dEJbM,https://i.ytimg.com/vi/_UPSU2dEJbM/default.jpg
youtube,"Watch: Hamas Uses Motorised Paragliders To Cross Into Israel | Subscribe to Firstpost

Hamas used hang gliders to infiltrate into Israel. Videos show motorised paragliders being used to cross into Israel from Gaza. Hamas attacked Israel from land, sea and air. 

---

Hamas | Israel | Palestine | Gaza | Firstpost | World News | Latest News | Global News | International News | Trending News

#hamasattack #israel #palestine #gaza #firstpost #worldnews #latestnews #globalnews #internationalnews #trendingnews

Firstpost is an Indian news and media website. Get all the incisive opinions, in-depth analyses and other visual stories that matter to you and the world right here on this channel. 

Subscribe to Firstpost channel and press the bell icon to get notified when we go live.   
https://www.youtube.com/@Firstpost

Follow Firstpost on Instagram:
https://www.instagram.com/firstpost/ 

Follow Firstpost on Facebook:
https://www.facebook.com/firstpostin/ 

Follow Firstpost on Twitter: 
https://twitter.com/firstpost",,264441,"{'comment_count': '579', 'like_count': '3909', 'view_count': '263862'}",Firstpost,,2023-10-08 10:20:26,,https://www.youtube.com/watch?v=-rHqTnzKDdE,https://i.ytimg.com/vi/-rHqTnzKDdE/default.jpg
