all_fd601ea4e86b84c636ab557a9002657928071086f3c592fa5d1a6c7759efa03c,,,,,,,,,,
platform,Tweet,Sentiment,,,,,,,,
twitter,"Who do you think you are? You're unelected, and have no authority to determine EU foreign policy, which is set by @EUCouncil. Europe does NOT ""stand with Israel."" We stand for peace. You do not speak for us. If you've nothing constructive to say, and you clearly don't, shut up.",0,,,,,,,,
twitter,"What I think every time someone gets angry at what Gaza did in retaliation.

Quit being hypocrites. 

#Gaza #Israel #Palestine https://t.co/3Fy9OaD0ek",-1,,,,,,,,
twitter,"Breaking News Israel: US weapons left behind in Afghanistan used to attack Israel.

A high-ranking Israel Defense Forces (IDF) commander said US weapons left in Afghanistan by the Biden administration were found in the hands of Palestinian groups active in the Gaza Strip.

The… https://t.co/AHCYpEIkcO",0,,,,,,,,
twitter,"This might be one of the most important documentaries that anyone can watch right now given current events and escalations between Hamas, Israel, Iran, and the US. 

All wars are bankers wars.

If you are still caught up in the left vs right, Israel vs Palestine, Ukraine vs… https://t.co/1X7oWbwsY5",0,,,,,,,,
twitter,"Share this. 

#Israel_under_attack https://t.co/3oCGHGfN3G",1,,,,,,,,
twitter,"Israel has been terrorizing Palestinians every single Ramadan, Eid, and Christmas for the past 70 years please shut up",1,,,,,,,,
twitter,"🔥🚨DEVELOPING: Middle East Monitor reported that Joe Biden approved the release of $75 million dollar aid to Palestine just hours before the attack on Israel. 

In a quiet move bypassing Republican obstructionism, US Secretary of State Antony Blinken has approved the release of… https://t.co/lYrPwH7enw",0,,,,,,,,
twitter,"🇳🇱 This was Rotterdam today. 

Muslim communities all over Europe are coming out in support of Hamas’ efforts to wage their bloody jihad against Israel and its citizens.

Everyone with a sense of reality can see it coming from miles away: the Muslim
fighting-aged males throughout… https://t.co/ztyinoLHMC",-1,,,,,,,,
twitter,"Remember when Obama sent pallets of cash to terrorist central, his beloved Iran? And now his proxy puppet, Biden, stacked off another 6 billion just weeks ago. Those American taxpayer dollars bought the rockets we witnessed killing innocent Israeli civilians yesterday. #Israel",1,,,,,,,,
twitter,Hamas is claiming Ukraine sold them the weapons they used in the attack today against Israel.  https://t.co/SZ9vAAQIhF,0,,,,,,,,
twitter,"What does Israel's occupation of Palestinians look like?

This former Israeli soldier told @dena how the Israeli army controls every aspect of Palestinians' lives. https://t.co/51jYryt9wL",-1,,,,,,,,
twitter,,,,,,,,,,
twitter,"🚨BREAKING: Minister of Defence of Israel: ""The rules of war have changed, we will cripple Gaza so that it will remember it for the next 50 years."" https://t.co/1stWmfkE5c",1,,,,,,,,
twitter,"BBC doing what they do best: push Israel's narrative. However,  @hzomlot  did a brilliant job of challenging the hypocrisy of the BBC👍👍.  One of the best interviews I’ve seen. 

Please watch the video below 👇

Some key points made my Husam. 
 
▪️Do not under-estimate people's… https://t.co/nFq6RQEeZm",0,,,,,,,,
twitter,BREAKING: Hamas is claiming Ukraine sold them the weapons (US-funded) that they used in the attack today against Israel.,0,,,,,,,,
twitter,"Hamas apparently knew how to get around Israel’s Iron Dome defenses. They probably learned this from Iran. Iran almost certainly got the information from Russia. And who gave it to Russia? Sure looks like it was Donald Trump, at the request of Putin: https://t.co/dDrVhVNWqx",0,,,,,,,,
twitter,🔥🚨DEVELOPING: The people of Palestine are posting about how President Trump created peace between Israel and Palestine. The world needs President Trump. https://t.co/w7udeOKzam,0,,,,,,,,
twitter,"It looks like a horror movie, but it's near a Kibbutz in southern Israel.

This was a massacre. #Israel https://t.co/PgOMTMIoWJ",1,,,,,,,,
twitter,"Personal Thoughts: 
(not for everyone, feel free to skip)

For the longest time, I struggled with my identity.

A Palestinian kid born inside Israel. Like…wtf. 

Many of my friends refuse to this day to say the word “Israel” and call themselves “Palestinian” only. 

But since I…",0,,,,,,,,
twitter,"Let me say this as clearly as I can.

This is not a moment for any party hostile to Israel to exploit these attacks to seek advantage.

My Administration’s support for Israel’s security is rock solid and unwavering.",1,,,,,,,,
twitter,"FLASHBACK: Trump shared classified intelligence from Israel with Russia - and admitted to it. 

Israeli intelligence feared it would end up in the hands of Iran. https://t.co/5ZyJbVILqC",1,,,,,,,,
twitter,"The over 250 Bodies which have been discovered at the Site of a Music Festival for Peace in Southern Israel reportedly consists of many Foreign Nationals including Americans, Germans, Canadians, and Norwegians.",1,,,,,,,,
twitter,"This isn’t hard to follow:

Trump gave military intel to the Russians. The Russians, who are extremely close allies with Iran, gave it to Iran.

Iran gave that information to Hamas.

Hamas used it to attack Israel.

This is why it intel security matters. Republicans DO NOT CARE. https://t.co/aVBhg3j5C1",1,,,,,,,,
twitter,"WATCH: Blinken finally had to admit that cutting the $6,000,000,000 check to Iran caused Hamas to attack Israel.  https://t.co/LwquVrjK6A",1,,,,,,,,
twitter,"What worries me about the “new war” is that:

The Clinton’s support Israel.
The Obama’s support Israel.
The Biden’s support Israel.
The CIA supports Israel.
The Mainstream Media supports Israel.
The EU supports Israel.
NATO supports Israel. 

Think about that.",-1,,,,,,,,
twitter,"BREAKING:

NBA legend Amare Stoudemire DESTROYS Black Lives Matter and announces he stands with Israel! https://t.co/0nxXxRpHXM",1,,,,,,,,
twitter,"Israel is the occupier. 

Palestine is the occupied.

No ifs, ands, or buts.",-1,,,,,,,,
twitter,"🇷🇺🇵🇸🇮🇱 #BREAKING: Russian Hacker Group Takes Down Israeli Government Website

Killnet’s statement:

“Government of Israel, you are to blame for this bloodshed.

Back in 2022, you supported the terrorist regime of Ukraine.

You betrayed Russia.

Today Killnet officially informs… https://t.co/tyQ6l7WZLL",-1,,,,,,,,
twitter,"🇮🇱 Netanyahu announces that Israel is starting a blockade of Gaza and will cut it off from all electricity, fuel and goods coming in from Israel

🇷🇺 To put this in perspective — even Putin still supplies gas and oil to Ukraine &amp; Europe. https://t.co/G10MKGZPiO",-1,,,,,,,,
twitter,"here's a thread of how israel has hurt palestine over the years, because some of you are very uneducated. 

palestine has been under attack for so long but suddenly you guys want to speak up and defend the attackers. 

TRIGGER WARNING ‼️ violence, death, b0mbs, beatings",-1,,,,,,,,
twitter,"As Israel begins its counteroffensive operations, there are likely going to be retaliatory attacks around the world by Hamas sympathizers in countries that support Israel

This means America will likely be hit, especially since Hamas operatives could’ve already crossed through…",1,,,,,,,,
twitter,"🚨BREAKING: RUSSIAN HACKER GROUP KILLNET HAS HACKED THE ISRAEL GOVERNMENT WEBSITE

The Russian hacker group Killnet has expressed support for Hamas and made the following statement about Israel:

""Israeli government, you are responsible for this bloodshed. Back in 2022, you… https://t.co/gh1QirBOMv",-1,,,,,,,,
twitter,"Israel is at war- meanwhile:

1. House is stalled until Republicans select Speaker candidate;

2. Senate is out this week;

3. No confirmed US ambassador to Israel; 

4. Ukraine aid package isn’t moving; 

5. Tuberville continues barricade 300+ military noms. 

Republicans must…",0,,,,,,,,
twitter,"NEW: Hamas spokesman Ghazi Hamad tells the BBC that the terror group had direct backing for the attack on Israel from Iran.

Three weeks ago, President Biden allowed for $6 billion in frozen funds to be delivered to Iran.

The Biden admin “stressed” that the money could only be… https://t.co/PT7WwuWomg",1,,,,,,,,
twitter,"Jamie Lee Curtis makes post in support of Israel with photo of Palestinian children, as specified by the photographer herself. https://t.co/6goUu2DCZ7",1,,,,,,,,
twitter,,,,,,,,,,
twitter,"🚨CRITICAL: How The Biden Administration FACILITATED &amp; FUNDED the Barbaric terror attacks on Israel:

- Shortly after Joe Biden took office, Secretary of State Antony Blinken announced that the administration would be resuming direct payments to the Terror Regime in Gaza.

-…",1,,,,,,,,
twitter,"We. Will. Never. Lose. Hope. 🇮🇱

https://t.co/qk2aAG4zQw",1,,,,,,,,
twitter,"They won't talk about the 33,000 innocent children Israel has killed since 2008. Free Palestine 🇵🇸",,,,,,,,,
twitter,"i got asked to do a thread of celebrities that support Palestine but today i only saw simihaze posting in support of Palestine and they’re Palestinian. is sad cause all their close friends are posting “i stand with israel” knowing simi, haze, fai, gigi and bella are Palestinian. https://t.co/z6fUIjjhdO",-1,,,,,,,,
twitter,"America stands with Israel ✊

#ALWAYS https://t.co/kM3e9S125s",1,,,,,,,,
twitter,"BREAKING: Republican 2024 presidential candidate Nikki Haley is humiliated on live national television as Meet the Press host Kristen Welker calls her out on a whopping lie about Pres. Biden and the attacks by Hammas against Israel. 

It all started when Welker asked Hailey if… https://t.co/CalHaZp33T",1,,,,,,,,
twitter,"Arab nations are standing with Hamas and against Israel in 2023, just like Arab nations were standing with Pakistan and against India in 1971.

This is a war of civilisations. There is no Jew or Hindu here; there is only believer and non-believer. Al Kufr Millatun Wahida. https://t.co/4ze0d688H7",-1,,,,,,,,
twitter,"While Palestinian fighters were given strict orders to respect churches and monasteries, Israel responded to the attacks by bombing a Mosque in Gaza. https://t.co/ob0TlKcY7X",-1,,,,,,,,
twitter,"She wasn't murdered, raped or abused. Footage showed her moments later safe in Gaza.

She was taken captive as a ""bargaining chip"" to free 1000s Palestinians whom Israel detains without charges, evidence or trial (aka administrative detention). Both violate int. law! https://t.co/rdR9bJoYTf",-1,,,,,,,,
twitter,"This is not just an attack on Israel—this was an attack on America.

Finish them, @Netanyahu.

They should have hell to pay for what they have just done. https://t.co/0KKDwvOITS",1,,,,,,,,
twitter,"Tamar, Yonatan and their children Shachar, Arbel, Omer. 

An entire family wiped out by Hamas terrorists. 

There are no words 💔

May their memory be a blessing. https://t.co/CoFeSJ9NPJ",1,,,,,,,,
twitter,"TRIGGER ALERT:

This mother and her two young children were kidnapped and taken hostage by Hamas. 

They are currently being held by Hamas terrorists. 

Their family asked to share their photos. 

Please help us amplify their request. https://t.co/CknaT5q0HK",1,,,,,,,,
twitter,The best way to satisfy everyone would be to dissolve Israel and establish a new Jewish homeland in Delhi.,-1,,,,,,,,
twitter,,,,,,,,,,
twitter,"The scenes we have seen in Israel over the last 36 hours are truly horrifying.

I spoke to Prime Minister @netanyahu earlier today to assure him of the UK’s steadfast support as Israel defends itself against these attacks.

Terrorism will not prevail. https://t.co/5EGoqiZM8b",1,,,,,,,,
twitter,if my kid Respected Israel i would have him tested for rabies,-1,,,,,,,,
twitter,"1. La lucha palestina nunca ha sido por reivindicar sus derechos.
Sólo ha sido por destruir a Israel.
Te voy a platicar ciertas verdades -hechos históricos objetivos- que a los propalestinos no les gusta enfrentar.
Pero las cosas, como son.
Agárrate.",,,,,,,,,
twitter,"Breaking News Israel: Spokesperson of Izzuddin Al-Qassam Brigades, Abu Obaidah:  

""We thank the Islamic Republic of Iran who provided us with weapons, money and other equipment! He gave us missiles to destroy Zionist fortresses, and helped us with standard anti-tank missiles!""… https://t.co/bP6rCGMHQ6",-1,,,,,,,,
twitter,"Cutting off energy to a civilian population is an explicit war crime. 

But I doubt many of the ""Israel has every right to defend itself"" will care much about that.",-1,,,,,,,,
twitter,"मारे और घायल हुए इज़रायलियों की संख्या बढ़ती ही जा रही है 😢।

इज़राइल अपने नागरिकों की रक्षा के लिए प्रतिबद्ध है| हमें अपनी प्रार्थनाओं में याद रखें। 🙏

#Israel #Israel_under_attack #IndiaStandsWithIsrael #IsraelAtWar https://t.co/gY1bipxhch",1,,,,,,,,
twitter,The Israel-Palestine story for beginners. https://t.co/PZW8v0gS9w,0,,,,,,,,
twitter,"11-year-old Tala Abu Daqqa is the sole surviving member of her family after Israel bombed their home in Gaza, killing all except her. https://t.co/MCPQSsWucq",-1,,,,,,,,
twitter,"Israel has been poisoning the water supply of Gaza for many years now and toxifying the soil, ensuring that it will soon become uninhabitable. For Palestinians breaking free is literally a question of life and death. They are being poisoned, as Norman Finkelstein says: https://t.co/e0Ud49lyZq",-1,,,,,,,,
twitter,obsessed with jamie lee curtis posting a photo of palestinian children in gaza being terrorized by israel as a way to show support for israel. y’all can’t even be wrong right,-1,,,,,,,,
twitter,"I was in Israel when the horrific attacks carried out by Hamas started on Saturday. My team and I are now safe, but like many we are shaken, angered, and heartbroken by the hundreds killed, the thousands injured, those taken hostage, and all who are directly affected by these… https://t.co/E4BgEZxSTC",1,,,,,,,,
twitter,We will never fail to have Israel’s back. https://t.co/3JM8d665iJ,1,,,,,,,,
twitter,,,,,,,,,,
twitter,"Hamas supporters in the West Bank celebrated what happened in Israel earlier today. Draw your attention to the weapons they’re carrying. Those are American weapons—M4s. 

Just what happened to the billions of dollars in arms Joe Biden left behind in the failed withdrawal of… https://t.co/ILTUr0iNOE",1,,,,,,,,
twitter,The vast majority of the people of Europe do not support the brutal Apartheid State of #Israel - The vast majority of the people of Europe support the people of #Palestine who have been Persecuted + Terrorised by Israel for so many years - If only the #EU was a real democracy...,-1,,,,,,,,
twitter,"Thousands of Germans gather in Berlin to show solidarity with Israel.

They sang the national anthem of Israel. This makes me emotional. THANK YOU. 🇩🇪🇮🇱 #Israel https://t.co/C7J1MdkxfW",1,,,,,,,,
twitter,"🇵🇸🇮🇱 Andrew Tate’s Political View On Palestine - Israel

“I do find it extremely suspicious that the most feared intelligence agency on earth didn’t manage to detect an invasion.” https://t.co/3IK937gBuC",-1,,,,,,,,
twitter,"JUST IN - Israel's cabinet invokes Article 40 Aleph, officially declaring war for the first time since the Yom Kippur War in 1973.",-1,,,,,,,,
twitter,"⭕️ นาทีที่ผู้โดยสารลงเครื่องที่สนามบิน Ben Gurion ,Tel Aviv อิสราเอล แล้วเกิดการโจมตี ทางอากาศทำให้ต้องหมอบกลางลานจอดแบบนี้

❌American Airlines, Air France, Lufthansa, Emirates, Ryanair,Aegean Airlinesฯลฯยกเลิกเที่ยวบินไปอิสราเอลแล้ว #อิสราเอล  #israel 

 https://t.co/khDUyfe5kp",,,,,,,,,
twitter,".@efenigson:

“I served in the IDF 25 years ago in the intelligence forces.. there’s no way, in my view, that Israel did not know what’s coming…Something is very wrong here”

https://t.co/iewZWnU66n",-1,,,,,,,,
twitter,"Imagine if you and your family had to go through this…

This is the reality for Israelis right now. #Israel #Gaza https://t.co/Q5FXDxvygG",1,,,,,,,,
twitter,,,,,,,,,,
twitter,"Ilhan Omar, AOC, Cori Bush, Rashida Tlaib and the entire SQUAD should be expelled from Congress for their hateful rhetoric towards Israel.",1,,,,,,,,
twitter,"Siendo las 22:58 del 7/10/23 se consigna y se registra que de las dos potenciales candidatas a la presidencia de México, sólo una ha publicado su posicionamiento sobre los ataques de la organización terrorista Hamas al pueblo de Israel. https://t.co/rTCj31YVPW",,,,,,,,,
twitter,"🚨| This is a thread about whats been happening or going on in Palestine or to Palestinian that the media trying to silence them about. Israel is NOT the victim. From the river to the sea, Palestine shall be free 🇵🇸",-1,,,,,,,,
twitter,"This morning, I spoke with @IsraeliPM to express my full support for the people of Israel in the face of an unprecedented and appalling assault by Hamas terrorists.

We will remain in close contact over the coming days. 

The U.S. will continue to stand with the people of Israel.",1,,,,,,,,
twitter,"Israeli children kidnapped and kept in cages by Hamas.
This is barbaric but what do you expect from savages.

#Israel #Hamas #Palestine #Palestinian #IronDome #Gaza #TelAviv https://t.co/9WznUKa5lA",1,,,,,,,,
twitter,"We need to work with Israel to track serial numbers on any U.S. weapons used by Hamas against Israel.

Did they come from Afghanistan?

Did they come from Ukraine?

Highly likely the answer is both.",1,,,,,,,,
twitter,"Rashida Tlaib, the only Palestinian member of Congress, comes out with the best statement, and is now being targeted by far right conservative cretins as well as liberals for simply daring to state the truth about Israel's genocidal occupation of Palestine https://t.co/tHnLLemmeh",-1,,,,,,,,
twitter,,,,,,,,,,
twitter,"Hamas started a war against Israel with the worst massacre of innocent civilians in Israel’s history.

We paid a heavy price; but we will restore security to the people of Israel.

Full statement from @IDFspokesperson: https://t.co/ZzIZuaqvsP",1,,,,,,,,
twitter,"If Hamas stopped fighting, there would be peace. 

If Israel stopped fighting, it would cease to exist.",1,,,,,,,,
twitter,"What happened to Israel could happen to America.

We have been invaded by aliens from over 160 different countries.

We don’t know who they are or where they are. There are so many got-aways the Biden admin can’t even keep up with them.

This should be a wake up call. https://t.co/b13AWAouUI",1,,,,,,,,
twitter,"This is Shani.

She was from Germany and was attending a festival in Israel when Hamas terrorists kidnapped and murdered her.

They then paraded her naked body on the back of a pickup truck around Gaza as people spat on and beat her.

Never forget. https://t.co/GIv1kUT6lv",1,,,,,,,,
twitter,"HOLY SHLIT

Hamas paradropped right into an ongoing rave in Israel

They had no idea what was coming https://t.co/dl78zDkRIM",1,,,,,,,,
twitter,,,,,,,,,,
twitter,,,,,,,,,,
twitter,"Yesterday, Israel faced a dastardly terror attack, just like Mumbai was targeted on 26/11/2008. Israel has declared war and their military has struck back. What did India, under a weak kneed Congress, do?

Nothing. It sent dossiers. Infact senior Congress leaders tried to blame… https://t.co/Vj5bI6E8oA",1,,,,,,,,
twitter,"The Palestinian view from the West Bank: my conversation with Palestinian activist and legislator @MustafaBarghoti, who is not connected to Hamas, about the terrorist group’s offensive in southern Israel https://t.co/LYsAI5bFfa",1,,,,,,,,
twitter,"All dead. Butchered by Hamas terrorists in Kibbutz Nir Oz, Israel for being Jewish.

The entire family, Tamar, Yonatan, their 6-year-old daughters - Shahar &amp; Arbel, and their 4-year-old son Omer. 

Remember their faces. https://t.co/OBzcxDmiv3",1,,,,,,,,
twitter,"Reminder that Republicans, at this moment, are holding up the appointment of 300 senior Pentagon officials and the next Ambassador to Israel.

We also lack a Republican Speaker of the House to pass additional support for Israel.

All of these things might be useful right now.",1,,,,,,,,
twitter,"With our soul and blood, we redeem you, O Al-Aqsa, May Allah protect Al-Aqsa. Aamiin

#Gaza #Hamas #Israel #Palestinian #طوفان_الأقصى https://t.co/WTXmWUJizf",-1,,,,,,,,
twitter,,,,,,,,,,
twitter,"Hamas uses the EXACT lanugage as BLM. Watch closely—they are funded by some of the same groups, they have many of the same complaint—they even protest together.

What Hamas did to Israel is being watched closely by BLM race arsonists in America.

Playing into victim narratives…",1,,,,,,,,
twitter,"This BBC reporter from Gaza is telling the *truth*. Israeli forces warn civilians to vacate areas they are about to hit, to save innocent lives. That is the difference between democratic Israel and the butchery of Hamas. All people of conscience know instinctively which is right. https://t.co/IHLLSAK0bU",1,,,,,,,,
twitter,🚨BREAKING: The US military moves an aircraft carrier near Israel to show Washington's support. https://t.co/XepMBU2Oyx,1,,,,,,,,
twitter,🚨BREAKING: Israeli PM Netanyahu says security cabinet has approved decisions to “bring about the destruction of the military and governmental capabilities of Hamas and Islamic Jihad in a way that will negate their ability and desire to threaten and harm the citizens of Israel…,1,,,,,,,,
twitter,"Today the following brave police officers gave their lives to protect the citizens of Israel. May their memories forever be a blessing. 

Names have been transliterated from Hebrew, forgive me if some of the English spellings are off. 

Martin Kozmitzkas z""l
Alik Posniakov z""l… https://t.co/QK2DXhJ8eh",1,,,,,,,,
twitter,"No Leader from I.N.D.I. Alliance has condemned Hamas terrorist attacks on Israel. 

Whereas PM Modi was first to condemn the Hamas attack on innocent Israeli citizens. 

Choose your leader wisely 🙏",-1,,,,,,,,
twitter,"Hamas supporters in Canada are celebrating Terrorist Attack on Israel!

India rightly said, Canada is becoming a safe haven of terrorists! https://t.co/n6EghyU4LK",1,,,,,,,,
twitter,"हम सभी भारतीयों को उनके अटूट समर्थन के लिए धन्यवाद देते हैं| 🇮🇱🙏🇮🇳

#Israel #Israel_under_attack #IsraelUnderAttack #ऑपरेशन_स्वॉर्ड #इजराइल #IndiaStandsWithIsrael 
@AskAnshul @Iyervval @MeghUpdates @AsYouNotWish @erbmjha https://t.co/vzv8O2OLMa",1,,,,,,,,
twitter,"“We know israel is going to kill us anyways. We are starving, we are being besieged, we are being dispossessed, we are being displaced. We know all of this. Israel is going to kill us anyways. Israel wants us kneeling… So why not fight back and die in dignity?”",-1,,,,,,,,
twitter,,,,,,,,,,
twitter,,,,,,,,,,
twitter,“Black lives matter” and “i stand with israel” are two things that can’t coexist. and no it isn’t that complicated. give them people they damn land back,-1,,,,,,,,
twitter,,,,,,,,,,
twitter,"I don’t stand with Israel.
I don’t stand with Hamas.
I don’t stand with Ukraine.
I don’t stand with Russia.

I don’t pick sides because I don’t stand with governments or ruling militias— period.

I stand with the innocent men, women, and children who are harmed by what…",0,,,,,,,,
twitter,"My prediction is that in this attack on Israel, you will find weapons that were not only surrendered in Afghanistan, but also weapons that were given to Ukraine, involved in the slaughter.

And no one - not even those most intelligent pundit of pundits - will be able to piece…",1,,,,,,,,
twitter,"Malaysia passport holder is valid for all countries except Israel. 

Any malaysian citizen who supports Israel should give up his nationality and leave this country.  

Thanks in advance.",-1,,,,,,,,
twitter,Hamas literally murdered and then kidnapped kids and elderly out of their homes and US congressional Democrats released statements demanding Israel de-escalate. I've never seen this. Ever.,1,,,,,,,,
twitter,"Imagine what our intel agencies could have done to prevent an act of war against our ally Israel if they spent their time spying on our enemies like Iran instead of spying on Catholic churches, tagging school board parents as terrorists, and jailing their political opposition.",1,,,,,,,,
twitter,"After observing the horrific crimes against innocent people in Israel by Hamas, pro-Palestine protesters take over the streets in New York City.

To recap: Hamas terrorists paraglided into a music festival, murdered innocent men and women at the festival (reports say 250+) and… https://t.co/iTryTbBRnA",1,,,,,,,,
twitter,"13 more Hours left for Palestinian Women &amp; Children to evacuate Gaza before it is leveled and turned into a parking lot for the world to see. This will be an important lesson for jihadists and Jew haters about why you should never attack Israel with rockets and violence. 

Tick…",1,,,,,,,,
twitter,"Rockets are raining down on Israeli towns right now. 

We need to immediately help replenish Israel’s stockpile of Iron Dome missiles to protect more innocent civilians from getting killed.
 
Let’s make sure Congress can unite and assure Israel has what it needs to destroy Hamas.",1,,,,,,,,
twitter,,,,,,,,,,
