"cleaned_text","created_at","total_interactions_count"
"For the next 4 daysis offering free ebook versions of titles that explore Palestines history  struggle for justice on their website. Im seeing a lot of misinformation false statements and inflammatory language around whats going on right now. READ.","11",9780
"The West lied about Vietnam. The West lied about Iraq. The West lied about Afghanistan. The West lied about Libya. The West lies about Syria. The West lied about Russia. But apparently we are suppose to listen to their lies about Palestine.","11",12724
"The story of beheaded babies in Kfar Aza originated from one source an Israeli reservist who also led riots against the Palestinians of the occupied town of Huwara earlier this year and who is a member of an apocalyptic cult dedicated to Palestine's destruction I report with","11",10938
"We have witnessed terrible images come out of Israel and Palestine that deserve no excuse. Individuals worldwide both proPalestine and proIsrael gathered to not only spread disinformation but drown out the voices of those trapped in Gaza or victimized by Hamas. Apartheid","11",14616
"I just need someone to ask one of these celebrities to their face why if they are so against violence and terrorism they did not say anything when Israel was terrorizing Palestine which is largely children for literal decades","11",46481
"Just because we are queer.doesnt mean we cant support Palestine! Gayz for Palestine is one of the most important groups in the world!","11",20366
"If you aren't careful the newspapers will have you hating the people who are being oppressed and loving the people who are doing the oppressing. Malcolm X Gaza Palestine","11",7875
"Palestine  He survived and his brother died in front of his eyes .. A Palestinian child speaks about the last moments with his brother who was killed in an Israeli air strike on their neighborhood in Gaza. 11.10.23","11",8915
"BREAKING Jordan officially supports Palestine The Jordanian King We will not deviate from defending the just cause of the Palestinian people until they regain their full rights. The Palestinian people must obtain their independent sovereign state on the 1967 borders","11",12539
"Some may wonder how Gaza maintains the will to carry on resisting Israeli aggression? The answer is simple. They believe in Islam and Allah SWT brings them comfort. The World has abandoned them but Allah has not. Gaza Palestine Islam","11",12275
"This video still baffles me because I know every single one of them will go on to clock into work like normal and go on with their day. But someone speaking up on Palestine will get fired for that","11",11078
"FT Palestine 65 India Palestine edge India in this entertaining ACFutsal2024 Qualifiers Group E match to end on a high note!","11",17704
"BIG BREAKING NEWS  Taliban refuses to help Palestine. Huge setback for Hamas Taliban said it can't support Palestine as it doesn't support Terrorism. Taliban won't send it's fighters to Palestine against Israel. Taliban said it is in the process of building Afghanistan","11",18944
"Fajr  Pray for Palestine Dhuhr  Pray for Palestine Asr Pray for Palestine Maghrib  Pray for Palestine Isha  Pray for Palestine Tahajjud  Pray for Palestine The only aid which will reach without any boundaries.","11",11821
"People like Ilhan Omar Rashida Tlaib and AOC have no place in Congress. Instead of denouncing the terroristic acts of Hamas they threw their support behind Palestine and Hamas. They should be expelled from Congress.","11",14226
"Taliban appeals for peace amid IsraelHamas war  War should stop both sides should adopt the path of Peace. Taliban will not send fighters to Palestine against Israel. Taliban doesn't support terrorism  will not get involved in it.","11",13039
"If You Arent Questioning The Israel Palestine Hamas Situation Than You Need To Watch This This Is One Of The Wildest Things You Will EVER Watch About 10 days after 911 I went through the Pentagon and one of the generals called me and he said Sir you got to come in. You got","11",6649
"It does not matter where you are from. Palestine is in every Muslims heart. You cant call yourself a true Muslim if you dont weep for Palestine. May Allah protect our people.","11",10279
"Our hearts bleed for the innocent lives lost in Gaza. The current attack by Israel on Palestine is nothing short of an outrageous act of aggression. It is war crime to stop food water and other essential supplies to Gaza. The international community must take immediate action to","11",9129
"Palestine will be free  we shall return Gaza  ","11",8602
"By far the biggest IsraelPalestine misinfo I bought for years was that its morally complicated. Morally speaking its cartoonishly uncomplicated. SOLVING the problem is complicated. But that doesnt mean Israels government is any less the villain","11",30750
"if you express support for the genocidal Israeli occupation regime as it mass murders Palestinian children it benefits your career. If you express support for Palestine you will be smeared as an evil monster hounded fired your life destroyed. This is freedom of speech","11",13914
"Anonymous condemns ALL KILLING  we condemn the attacks upon citizens who are noncombatants both Israel and Hamas are guilty of this and the filming of innocent men women and children being slaughtered or used as hostages for political purposes. To the People of Palestine","11",17937
"When Palestinians say Free Palestine they get called antisemitics But Israelis can say whatever they want without consequences This is becoming hilarious","11",4741
"People stop asking if I fear the consequences of speaking up for Palestine. I'm a grandchild of East European peasants I don't own anything I don't have a career and I don't even have a future. All I inherited is my principles and no one can bully me into losing them","11",17060
"How much longer will we the people tolerate a university system that uses hundreds of billions of our tax dollars to fund terroristsupporting groups like the preposterously selfnamed Students for Justice in Palestine?When will state legislatures defund these antiacademic","11",9393
"The IsraelPalestine conflict did not erupt overnight heres a brief history","11",4747
"This is the West's maskoff moment. Total inversion of oppressor and oppressed. Extraordinary racism of a kind I have never seen in my lifetime. Fanatical calls for genocide. This is what we meant all along when we said Palestine is the litmus test. This is prelude to fascism.","11",8700
"Stranger Things actor Noah Schnapp shares statement on Israel and Palestine You either stand with Israel or you stand with terrorism. It shouldnt be a difficult choice","11",41842
"Powerful and emotional dua for Gaza. Remember that dua is a powerful weapon. Far more powerful than any Israeli nukes. Gaza Palestine Islam","11",7076
"BIG BREAKING NEWS  Israel orders closure of Al Jazeera coverage in Israel due to its propaganda coverage Israel demolishes tower which was the hub of Al Jazeera  other Pro Palestine Media in Gaza. Founding leader of Hamas terror organization Abdul Fattah Dukhan is","11",11997
"The 2002 version of my ITV film 'Palestine Is Still the Issue' provides some necessary history to Gaza then and now.","11",5756
"I've been drawing about Palestine since 1998 when I was in the West Bank and since then I've realized that my cartoons are variations on the same theme. Year in and year out I witness the continuous USbacked ethnic cleansing promoted by Israel. Gazaunderattack","11",5187
"BREAKING Former CIA analyst Larry Johnson says Hamas weapons are 100 funded by the US whether the source is Ukraine Palestine or Afghanistan is unknown.","11",6478
"As the situation escalates in IsraelPalestine misinformation is rife. It can be difficult to decipher what is really happening and what is not. Our team has analysedexamples of misrepresented footage and imagery from the latest conflict","11",5713
"Hamas should be officially banned in India as a designated terror group as per UAPA law. Indias official stand or relations with Israel  Palestine wont be compromised with this step. Horrific terror attack in Israel by Hamas cannot be justified. There is no good or bad terror.","11",8206
"Bsdk India also supports Palestine historically. The current context of this inhuman strike is what is everyone condemning. Tera one sided fact check sabko pata hai. Btw Transparency of funding ka page update kiya kya apne website pe. Jab bhi puchta hu bhaag jaata hai.","11",8816
"The Ottoman archives are full of documents that attest to the fact that Jews were not permitted to own land in Palestine. This ban was particularly enforced during the time of Sultan AbdulHamid II. The reasoning behind it was that it was thought they would eventually try to","11",5960
"Bumrah Wife being an ICC presenter can show Solidarity with Ukraine Indian people neither we have any problem. But Rizwan showing solidarity with Palestine is issue for them... Hypocrisy.!","11",10796
"Another massive pro Palestine rally in Jordan. Hamas Isreal PalestineIsraelwar Gaza Jordan","11",8502
"Palestine fighters are praying on the roads during war.","11",5620
"106 years agoin Nov 1917the British signed the Balfour Declaration which laid the foundation for Israel. In it the stipulation was clear Nothing shall be done which may prejudice the civil and religious rights of existing nonJewish communities in Palestine. Alas","11",4577
"Hamas leader Ismail Haniyeh calls in Muslims around the world to join the jihad and give their lives for Palestine. This was broadcast in Al Jazeera.","11",5216
"Francedemonstrations for Palestine are forbidden UKwaving a Palestinian flag may be considered a hate crime What happened to free speech?","11",5118
"DJ Vlad calls out Drake and DJ Khaled for not speaking on the crisis in the Middle East with Israel and Palestine.","11",22520
"In the first telephone conversation between Ayatollah Raisi and His Royal Highness Mohammed bin Salman they agreed on the need to stop war crimes against Palestine. Islamic unity was emphasised and both expressed the view that the regime's crimes and the US green light would","11",7614
"American Hasidic Jews. Father and son are two proud antiZionist Jews and proud supporters of Palestine. May Gd always help this Father and son. Israel is not a Jewish state Jews are not a nationality Judaism is an ancient religious collective. Zionism can never represent","11",4809
"The UK is slowly trying to criminalise support for Palestine by making the waving of the Palestinian flag a hate crime.","11",6533
"Everyone is asking me do you have family in Palestine? Yes I do but every Palestinian to me is family and my family have been suffering for decades.","11",7297
"If you are silent about Palestine while your mother tongue is Arab you may as well bite it off. FreePalestine","11",7270
"Do you know whats so ironic? Dictatortalks about the Muslims in Palestine and how he supports them but at the same time he kills myMuslim brothers and sisters daily. Erdogan bombed a mosque in the Makhmur refugee camp this week injuring many","11",4240
"ICC prohibits cricketers from making political statement during such events. MS Dhoni was asked to remove the insignia from his wk gloves in the 2019 World Cup. Even in 2014 during a Test against India ICC had banned Moeen Ali from wearing Save Gaza and Free Palestine","11",6846
"When You Start Putting The Pieces Together The Israel Palestine Hamas Situation Looks Questionable Press secretaries confirm Barack Obamais controlling Joe Biden Obama scrubbed DHS Muslims terror records Joe Biden sends 6 billion to terrorist nation War starts Are you","11",2915
"BLM FLASHBACK In 2015 BLM cofounder Patrisse Cullors spoke about the IsraeliPalestinian conflict stating Palestine is our generations South Africaif we dont step up boldly and courageously to end the imperialist project called Israel were doomed. BLM's views","11",4027
"Video 1 AMU's students held a rally in support of Palestinethey got FIR Video 2 In Rajasthan's largest hindu templelots of Hindus were praying for israel and hosted the Israeli flagnothing happened Hypocrisy? FreePalestine Gazaunderattack GazaUnderAttack FreeGaza","11",2866
"Everyone looks the other direction when Palestine cries for help","11",38511
"The Ireland always stands with Palestine. The Irish leader talks about the illegal settlement of Israel in Palestine Watch the video. Gazaunderattack PalestineUnderAttack ","11",4050
"So far Free Palestine means from the river to the sea. It means the destruction of Israel. If you really think of yourself as a fair minded Arab or Palestinian then follow these steps 1 Denounce without caveats Hamas's terrorism and uncivilized bloody raid against","11",5230
"BREAKING Huge number of Egyptian people are driving this cars towards the Israeli border to participate in the battle against Israel and to protect Al Aqsa!!!  Israel Palestine GazaUnderAttack Hamas HamasTerrorists FreePalastine FreePalestine TelAviv","11",3811
"There are 3868000 Muslims in the UK. There approximately 300000 Jews. Surely that couldnt be the reason shadow Foreign Secretary David Lammy spoke at a Labour Friends of Palestine event in Liverpool on Tuesday. Vote Starmer get Islam.","11",5107
"Israeli extremists have escalated their brutality  the western society again exhibiting a stark contrast and double","11",3311
"Just pray make Israel and Palestine war no happen to Nigeria","11",3215
"Palestine is our heart and Palestine will be free In Shaa AllahPalestine","11",14666
"you either stand with palestine or you stand with ethnic cleansingoppressioncausing over 7 million to become refugees and the mrder of thousands of children. it shouldnt be a difficult choice. shame on YOU.","11",5387
"Response by the mission of Palestinein Geneva toand other European countries that have not uttered a single word of condemnation for the killing of Palestinian civilians.","11",2939
"If Ummah is the one body then Palestineis the Heart","11",8228
"From river to sea Palestine will be free. Long Live  down with","11",8688
"Bradford United Kingdompeople showing solidarity with Palestine. Hamas Isreal Palestine Gaza","11",4738
"BLM Chicago has deleted their tweet celebrating terrorism. They now say they aren't proud of the message they sent out but they continue to stand with Palestine  the people who will do what they must to live free.","11",5534
"My appearance on the Stew Peters show discussing the IsraelPalestine conflict. Why is American support for Israel so unwavering despite events like the USS Liberty incident?","11",4632
"The Israel lobby mask slips Their version of antiSemitism is not hatred of Jews but Palestine will be free.","11",3993
"From its inception Hamas has chosen armed resistance in its efforts to liberate Palestine from Israeli occupation.","11",3980
"The world is waking up to Palestine","11",4212
"No one has the right to kill civilians. We mourn those killed in Israel and Palestine. Itsan intolerable pain for families and loved ones. But no one has the right to cut water energy and food from 2.3 million in Gaza  that is mass deprivation and slow death. Its inhumane","11",5462
"i have also noticed a silence in social media like never seen before while the whole media is on israels side and dont care about palestine. how detached from the reality can you be???","11",6775
"Palestine  An Elderly Palestinian cites over destroying his home by Israeli air strikes in Gaza City. 11.10.23 By","11",2770
"Palestine  The Palestinian photojournalist Ali Jadallah lost his brothers in an Israeli air strike in Gaza today. 11.10.23","11",2609
"Alhamdulillah! Palestine have defeated India in Asian Futsal Championship. What a win and what a day! Love you my brothersPalestine","11",8196
"You didnt give a flying fuck about Israel until your media told you to do so You didnt give a fuck about Palestine until the media told you to do so You also didnt give a flying fuck about Ukraine Russia Iraq. Somalia Afghanistan or Libya until the media told you to","11",4022
"In the United States Hamas supporting Muslims and Black Lives Matter team up and chant for intifada  calling for an uprising and Islamic Jihad around the world. Islam IsraelHamas HamasTerrorism Palestine IsrealUnderAttack BlackLivesMatter Jihadis BLM Democrats","11",2133
"Celebrities are posting about IsraelPalestine with the intellectual capacity of a potato","11",7033
"AntiZionist Jews from Jerusalem marched in Sheikh Jarrah with Palestinian flags We Jews have lived here in peace with Muslims for centuries. We are Jews who are against Zionism and Israel they said. Palestine Hezbollah Israel Lebanon Gaza","11",4015
"Palestine  Palestinian children receive medical treatment in the hospital after they were injured in an Israeli air strike that hit Al Amal neighborhood in Khan Younis city . 11.10.23 .","11",1968
"This babies beheaded thing being disproven already and still being the main point in all these terrible takes shows you how strong propaganda still is. Especially when Israel has INTENTIONALLY massacred children in Palestine for decades on decades. Just Baffling.","11",7006
"DEVELOPING Here is extended footage of the PsyTrance party in Israel that was hosted by Supernova and was attacked by Hamas. It appears IDF tanks were already present during the party. I confirmed yesterday that this party had no relation to Palestine despite initial","11",3957
"I wrote about the Israeli occupation of Palestine and where the cycle of violence beginsnot with a single attack but by slowly and methodically over the course of generations vanquishing all hope among innocent people who have never known freedom.","11",3127
"Israeli occupation warplanes target Palestine Production Bank in Khan Younish south of Gaza Strip.","11",1780
"a lot of people who thought they were anti zionist are figuring out theyre zionists after all. if youre framing the decolonization of palestine as a problem of violence on both sides you do not support palestinian liberation. war is awful empire makes it inevitable","11",5727
"Heartbreaking scenes for the casualties of Gaza Strip. FreeGaza PalestineUnderAttack    Gaza GazaUnderAttack palastine Palestine FreePalaestine FreePalestine","11",2253
"You look for logic but it's nowhere to be found. You realise they just despise you no matter how much they speak about love and peace. Fake slogans they throw at us only when it suits their agendas. You don't have to be Muslim to support Palestine. You only need to be a human.","11",2346
"Some Muslim and Arab players in the Premier League said that they would leave the field if the victims of the people of Palestine were not respected.","11",8421
"Netenyahu was sure about Israels strangle hold on the United States since the 1980s. israel palestine","11",2265
"Please leave political interests behind consult your heart and mind support the weak  be a voice for the oppressed from the whole world for the sake of international interests be a human being PRAYFORPALESTINE SupportPalestine Revealthetruth","11",3069
"Help spread the truth about Palestine by sharing this video and countering misinformation","11",1811
"One of the most important discussions anyone can listen to right now. This is the type of discourse we should be trying to have about the situation between Israel and Palestine instead of endlessly retweeting the horror stories about what's happening to Israeli civilians and","11",3338
"Leave children and women alone  Putin on IsraelPalestine escalation","11",3213
"If Russia occupied Palestine then wed be arming Palestinian resistance fighters with the worlds most sophisticated and powerful weapons.","11",3396
"While the whole world promotes the lie that the resistance in Palestine is killing and abusing prisoners  the resistance releases a woman and her children in front of the eyes of the whole world","11",2940
"Youtube really didn't want my military analysis of the IsraelPalestine conflict to be seen by the public. Demonetizing it was not enough as it was my best performing video ever. 220000 views within 1h30... So Youtube quickly agerestricted it an action which essentially halts","11",4650
"just donated 200 to the Middle East Children's Alliance who are providing emergency aid in Gaza right now. please give whatever you can. Palestine Children's Relief Fund is also good","11",1979
"We will put the world on notice PALESTINE WILL BE FEE","11",2454
"This is like the holocaust playing out in plain sight  The western media are allowing it. Israel's goal is to decimate Palestine including millions of innocent people.","11",5161
"Speaking from Qatar the head of Hamas calls for a global Day of Rage on Friday which will include terror attacks on Jews worldwide Funds are important but today we are asking for your blood and souls to be sacrificed for Palestine.","11",2106
"Palestinian photojournalists bravely document the immense destruction wrought by Israeli airstrikes in Gaza Palestine. Their lens captures the scale of civilian devastation that should concern us all.ProtectCivilians Gazagenocide","11",1708
"In this bleak hour while staunchly opposing Israeli Apartheid cruelties we must also do our utmost to fend off the sirens of antisemitism. No antisemitic tropes must be tolerated while campaigning for Peace  Justice for Palestine","11",4375
"Under Ottoman rule both Cyprus and Palestine was at peace. In Cyprus Turks and Greeks lived in peace. In Palestine Muslims Jews and Christians lived in peace. Peace was only destroyed when the British took administrative control over both regions TwoStateSolution","11",4097
"Oo thats not I know youre Jewish but its actually that you either stand with Palestine or you stand with mass genocide. Lets get it right Noah!","11",16265
"IsraelPalestine conflict Jeremy Corbyn I condemn all violent acts and urge a peaceful solution Sir Keir Starmer Israel has the right to withhold water and electricity to the Palestinians in Gaza Guess which one the UK press is portraying as a dangerous extremist?","11",2512
"Students and recent graduates are being harassed and doxxed and intimidated and apparently having jobs rescinded because of their stand for justice equality and decency. It is more than ever incumbent upon tenured professors to speak out against flagrant injustice in Palestine.","11",3031
"Breaking Big statement of India's top religious leadership All India Muslim Personal law Board says Act of Hamas is the natural Reaction of israeli atrocities calling it a terrorism is unjust and help of the Cruel Im saying from day one indian muslims supporting Palestine!","11",2907
"By ruling out any political process in Palestine and boldly asserting that 'the Jewish people have an exclusive and inalienable right to all parts of the Land of Israel' Prime Minister Binyamin Netanyahus fanatical government made bloodshed inevitable.","11",2105
"The list was brazenly racist targeting Black South Asian Latinx Muslim and MENA student groups. There was not one name from a Jewish group on the list even though there are Jewish student groups that have been vocal in their support for Palestine.","11",5565
"During interrogation HamasTerrorists accept that they raped womenkiIIed innocents beheaded kids Meanwhile Harvard We stand with Palestine BLM We stand with Palestine Liberals We stand with Palestine Who's more dangerous? IsraelPalestineConflict IStandWithIsrael","11",1870
"When it comes to coverage of Israeli and Palestine the mainstream media in the liberal West lacks all credibility. It operates as a propaganda mill for Israel. This must be remembered in the present and in the future.","11",2670
"Palestine  Ministry of Health in Gaza 4 paramedics were killed in an Israeli air strike that targeted an ambulance in Gaza today. 11.10.23","11",1534
"BREAKING UK police has arrested a young man for flying Palestine flag claiming the arrest was for common law breach of peace.","11",1557
"These are following G20 countries that recognisedunrecognised Palestine  Recognised Argentina Brazil China India Indonesia Russia Saudi Arabia South Africa Turkey Unrecognised Australia Canada France Germany Italy Japan South","11",7057
"In view of the ongoing developments in Israel and Palestine a 24hour Control Room has been set up atto monitor the situation and provide information and assistance. In addition 24hour emergency helplines have been set up at . Press","11",1867
"I rarely come on here anymore but if any students or academics are getting targeted because of their public support of palestine please don't hesitate to DM me and I will share what protective  antiharassment resources I can","11",2609
"Praying for safety and peace in Palestine.","11",12885
"France is cracking down on the Hamas supporters celebrating in the streets. Maybe they have finally had enough? IsraelHamas France HamasTerrorism Palestine IsrealUnderAttack","11",3055
"There is no titfortat. Its an official policy of displacement. Caller to American Journal lays out the spiritual and strategic truth about IsraelPalestine in a succinct 5 minutes.","11",2322
"This week many in the British media have peddled misinformation around the ongoing conflict in Palestine and Israel. These dangerous insinuations and conflations have nothing to do with reporting truthfully on the devastation of war or the many victims from both sides whose","11",2001
"Iranians stand with Palestine","11",6029
"Palestine  Israel attack the residential neighborhoods in Gaza with the internationally prohibited white phosphorus bombs. 11.10.23","11",1466
"It truly is you are either with the Palestinian resistance 100 or you are not at all. No condemnations of a people whove been caged and genocided for decades no equivocations between their violence and the violence of their colonizer. Palestine must be free first.","11",4007
