"cleaned_text","created_at","total_interactions_count"
"A Palestinian official speaks to the EU about Palestine Israel and the Middle East. Valuable context for the current situation. A must watch.","14",12350
"ProHamas and Palestine protesters in Times Square today. For everyone out there who claimed Trump supporters were Nazis here are real modern day Nazis.","14",17054
"Even animals have more humanity than Israelis! The lifeless body of a Palestinian child murdered by Israel and sponsored by the West. A cat gently caresses her! HamasTerrorist Isarael IsraelPalestineConflict IsraeliWarCrimes IsraelTerrorists Palestine GazzeUnderAttack","14",9376
"Today German police cracked down on peaceful protesters in Munich supporting Palestinians' basic rights jeopardising the freedom of speech and freedom to peaceful assembly. Germany Palestine","14",6695
"Huge protest in Barcelona Gaza's twin city in solidarity with the people of Palestine","14",9782
"Hamas sent terrorists on paragliders to a rave in Israel where they massacred the civilians so it's important to tape images of paragliders to your clothes at a pro Palestine demonstration.","14",11828
"Palestine  If you cant left the injustice at least tell everyone about it. Gaza.","14",6078
"My friends brother had a football game today  they had a moment of silence for israel so they all started yelling Free Palestine and even the non Arabs went along too","14",24644
"The German version of what is happening in Palestine FreePalestine GazaUnderaAttack IsraelTerrorists Ghaza","14",8366
"Palestine Where are you Arabs where are you Muslims ?A Palestinian child reacts over the death of his sister in an Israeli air strike and he did even knew that she was killed since the beginning of the Israeli aggression against Gaza. 14.10.23","14",7231
"It is right to condemn the continuing occupation of Palestine by Israeli military forces. Former Labour leader Jeremy Corbyn is speaking at a proPalestine demonstration in London. IsraelHamas latest","14",12162
"Breaking A riot nearly broke out when attendees of the London Palestine protest swarmed a dissident Iranian display near Whitehall that showed support for Israel the UK and Ukraine. They tried tearing down the Israeli flag. Protesters called the liberal dissident Iranians","14",10171
"Washington DC has been experiencing heavy military equipment passing by since the IsraelPalestine war started. Whats going on?","14",8906
"These guys are chanting Khybar khybar ya yahud  calling for the murder of Jews. It never takes long for antisemitism to surface amongst pro Palestine crowds. They need to be arrested and if possible have their citizenship revoked for extremist behaviour.","14",12028
"BREAKING Matt Gaetz calls on Middle Eastern countries to take Palestine refugees from Gaza Not the United States. Do you agree with Matt?","14",17599
"Just been fired for posting my support for Palestine if anyone knows any employment lawyers I would really appreciate it.","14",15573
"Scotland Yards War Crimes Unit has opened calls for evidence relating to war crimes in Palestine. In an incredible turn of events this could lead to UK government officials being prosecuted for war crimes by Scotland Yard and by the International Criminal Court.","14",7799
"In true Chicago fashion the bucket boys gave us a juke rendition of the Free Palestine chant","14",10687
"Berlin's public prosecutor's office will now classify the phrase From the river to the sea Palestine will be free as a criminal offense The public prosecutor's office sees the slogan as an initial suspicion of sedition","14",6980
"Dublin today. Standing with the people of Palestine. The world cannot stand by as Gaza is decimated. We needimmediate ceasefire. GazzeUnderAttack","14",10655
"Palestine Action left a message overnight for the  spreading the occupation's lies and manufacturing consent for israel's war crimes means that you have Palestinian blood on your hands ShutBBCDown","14",8805
"Instead of Gigi Hadid Bella is more vocal in support of Palestine. It is known that Gigi Hadid and Bella Hadid are the daughters of Muhammad Hadid. A Palestinianborn entrepreneur and real estate developer. They are of royal descent through Mohamed's Palestinian heritage.","14",7361
"PROPALESTINIAN PROTESTS IN LONDON A HUGE ARE TURNOUT The media is with Israel The people are with Palestine Gazagenocide","14",6916
"George Santos went on Bannons show to vent about the incident yesterday This man tells mewhat about the babies in Palestine? Are you kidding me! I dont care!","14",8490
"Had a really nice chat with Solomon who brought his daughter along to the London rally in solidarity with Palestine. Muslims and Jews united for peace justice and human rights. We will not be divided.","14",11576
"gigantic protest for palestine going on down at michigan avenue right now. an absolutely incredible turnout","14",18608
"After 17 and a half hours me and four young men ate three loaves of bread that I found with the corpse of a martyr. We wiped the blood off them and ate them out of hunger Gaza Palestine October 2023 Gazaunderattack GazaGenocide GenocidePalestine","14",4244
"In solidarity with Palestine.","14",18940
"Physically attacked and called terrorists earlier today at Bakerloo station as we left a peaceful protest in solidarity with Palestine. The woman repeatedly shouts Pakistani exposing her ignorance. Two Jewish women intervened and called her out.","14",9105
"We must all recognise that the targeting of civilians by military forces is a war crime as is the deprivation of water and other necessities to sustaining life. We must end the siege of Gaza deescalate the conflict and end the occupation of Palestine.","14",7205
"Why does egypt not allow the residents of Gaza to evacuate? Because if they leave Gaza once Israel will not allow them to return again they did the same to all of Palestine when they took it from them. It's called ETHNIC CLEANSING. What can Israel do to show that they","14",8276
"End the violence. End apartheid. End the siege of Gaza. Glasgow is a sea of Palestine flags this afternoon as thousands turn out for thedemonstration. Skotia Glasgow","14",6873
"FOOTAGE A massive demonstration in London showing support for Palestine. Source Quds News Network","14",7598
"WATCH Really really good video breaking down the history and context between Israel and Palestine Did you know this?","14",6166
"Reports from a friend that around 50 Jewish folks got arrested at Grand Army Plaza for standing with Palestine tonight. Its never been about being Jewish and always been about unquestioned support for Israeli apartheid occupation and ethnic cleansing","14",6313
"A simple question for the British police. Why on earth has Richard Barnard the cofounder of Palestine Action  who praised a proscribed terror group  celebrated a terror attack  and incited terrorism against British Jews  still not been arrested?","14",6473
"When Palestine is liberated and Israel falls as it eventually will its memory will be recalled as a mere blip in history just like Rhodesia remembered only for its racism the enormous violence it perpetrated and as a cautionary tale of the dangers of supremacist ideologies.","14",9600
"I dedicate this fight to the people Palestine! The war I went through tonight is nothing compared to theirs","14",23296
"If your employer has discouraged you from talking about IsraelPalestine text me at 2025101268 signal preferred. My DM is also open. I will protect your anonymity","14",7718
"Nick Fuentes with a more balanced and rational take on IsraelPalestine than the entire political class.","14",10683
"The French version of what is happening in Palestine ExposeTheTrurh IsraelTerrorists HamasTerrorist Palestine","14",4810
"resources to educate yourself about whats going on in palestine","14",3786
"I witnessed Chicagoans shut down Michigan Ave in support of Palestinians in Gaza. Thousands came out marching and chanting Free Palestine.","14",8264
"Most recent Zionist hoax Palestine has called for a Global Day of Jihad wherein Muslims will attack and exterminate nonMuslims  especially in countries like the USA. How idiotic do people need to be to believe this propaganda?","14",5412
"Don't underestimate how many of us want to see a free Palestine in our lifetime. 150000 in London and counting FreePalestine GazaUnderAttack","14",4986
"Great turnout in support of Palestine today outside Downing Street. Thousands came out amid UK authorities threatening behaviour targetinganyone showing support to Gaza ahead of Israel's planned ground attack. Palestine Gaza UK","14",4888
"I understand letters went out today instructing local Labour parties not to join any rallies in solidarity with Palestine Protesting war crimes is a fundamental right and duty of Labour members and all progressiveminded people Glad so many defied this and marched with us today","14",5533
"Dear European governments What a shameful spectacle of hypocrisy you are. You speak of free speech free press and general international law BUT You want to ban the Palestine flag. You want to ban peaceful protests. You want to ban speech and slogans in defence of","14",4500
"The largest demonstration in support of Palestine was held in Pakistan","14",5195
"I'm thirsty! Rescue teams are doing their best to rescue those under the rubble of their houses following Israeli attacks. Here they are sending drinking water to a thirsty child under the rubble. Gaza Palestine","14",2786
"Western governments are criminalizing solidarity with Palestine because they know that people of conscience all over the world will not tolerate the unfolding Israeli genocide that they have funded armed and endorsed. Free Palestine","14",5449
"This is the deadliest week ever for journalists covering IsraelPalestine in the more than 30 years thathas been covering attacks on the press. In less than a week 12 journalists have been killed eight injured and two are missing.","14",2862
"This is Terrorism nothing else. I stand with the innocent People of Palestine .","14",5221
"From the River to the Sea Palestine will be free FreePalastine EnoughIsEnough FreeGaza","14",4446
"Watching the world come together to fight for the liberation of Palestine is the sliver of hope Im holding on to","14",10832
"These two Palestine protestors at the rally in london have images of paragliders taped to them Hamas sent terrorists on paragliders to a rave in Israel where they massacred the civilians This is encouraging terrorism Arrest them","14",6317
"Don't forget where the Jews were in 1940! At the Palestine protest today on Buchanan Street in Glasgow Scotland a woman draped in Palestinian symbols taunted a man about the Holocaust.","14",4481
"At the Seattle Palestine rally the crowd repeatedly chants There is only one solution. They call for an intifada revolution referencing the Palestinian uprisings where suicide bombings were used to kill civilians on busses restaurants etc.","14",4029
"NEW Ive seen messages sent from the Labour leadership telling its MPs and council leaders not to attend any Palestine related protests and demonstrations this weekend  regardless of what they are","14",3943
"A protester holds a sign declaring LGBT stands with Palestine at the London rally today. The protest occurred one week after Hamas terror attacks on civilians in Israel. Hamasgoverned Gaza is run under Sharia law which criminalizes male samesex activity.","14",5327
"If you are not standing with GazaPalestine  this is the reason. ","14",3659
"Palestine  20 people were killed and over 80 were injured after bombing Al Fakhoura area by Israeli warplanes. 14.10.23","14",2486
"A message from Israel to Black Lives Matter. tells BLM supporters in the U.S. marching for Palestine that it's Israel's black community that should have their support. He emphasises that many black Israelis have been murdered by Islamist terrorists","14",4647
"BREAKING Huge demonstration in support of Palestine in London. According to the police more than 50000 people are in the streets.","14",6715
"Sudanese civil war Give war a chance","14",17713
"The attendees of the London Palestine protest chanted in Arabic about becoming Islamic martyrs for the alAqsa mosque in Jerusalem. The translated chant is By soul and blood we will sacrifice ourselves for you oh Aqsa.","14",4123
"Glasgow now! With Free Free Palestinemarching toward BBC! Thousands of people!","14",5155
"Palestinian protesters ask men with Taliban flags to leave. cdnpoli Mississauga Palestine Gaza Israel","14",5877
"approximately 100000 people came out today in London in solidarity with Palestine","14",7381
"What better way to spend shabbat than standing shoulder to shoulder with comrades for a Free Palestine.","14",6624
"The Labour Party has banned MPs from attending proPalestine demos and warned members that they may be expelled.is beyond contempt. Anyone who is still a member of this odious political party should resign today.","14",3361
"Please please speak up. Your voice matters your voice could make a difference. Imagine if this was your family and friends. They've lost everything. Don't stay silent share reposts and stand with the people of palestine.","14",2696
"Palestine  More injuries arrive to hospitals of Gaza most of them are children and women. 14.10.23","14",2309
"ProPalestine protesters wearing paraglider pictures on the streets of London right now. Hamas sent terrorists on paragliders to a rave in Israel where they raped mutilated and massacred 260 youngsters.","14",3356
"Iran has won the first round in the conflict with Israel. Iran is the biggest financier of Palestine which is struggling to get its state back from the occupation of Israeli forces. Iran won the first round.With 3000 Hamas fighters managed to plunge Israel into","14",4958
"The father found his son's body.my condolences Gazagenocide HamasTerroristIsarael IsraelPalestineConflict IsraeliWarCrimes IsraelTerrorists Palestine GazzeUnderAttack ","14",3271
"In the age of information ignorance is a choice Here is some books and resources to educate yourself about Palestine history and that its never a trend but a 75 years long of oppression and colonialism","14",2656
"A Jew explains why he supports Palestine.","14",3717
"The money Biden sent Palestine was ILLEGAL and it FUNDED the terror we're seeing today. In every corner of the globe Biden's foreign policy has made the world MORE DANGEROUS. He's been an outright DISASTER!","14",3403
"The Israeli invasionof Palestine brought to you by the same people as covid climate change rigged elections and censored social mediaTHAT post made Oct 9 just had the COPS and secret security CANCEL MY SPEAKING TRESSPASS ME and threaten to arrest me for being a","14",4009
"srail'in 1 haftadaGazze'ye att bomba ABD'nin 1 ylda Afganistan'a att bombaya edeer. Fulya ztrk Gazzelyor GazzeUnderAttack Palestine","14",3225
"Shadow banned on Instagram now. Dont STOP sharing the truth! Palestine will be free! We will find peace!","14",5900
"do you all know how utterly insane it is that all these big brands are pledging MILLIONS of dollars to israel while the us is giving them BILLIONS for weaponry and nobody is giving palestine anything. I feel myself slowly losing touch with reality how is this genocide working.","14",4341
"The solution to the IsraelPalestine conflict","14",7149
"palestine and israel discourse at the barbershop","14",8622
"Ambassadoraddresses tens of thousands of protesters in London against the war in Gaza Palestine GazaUnderAttack","14",3313
"You'll never see this in the Media. Gaza GazagenocideIsraelPalestineConflict PalestineLivesMatter Palestine","14",3012
"Loud and clear Justice delayed is justice denied. Time to rise against oppression stand with Palestine and demand a world that values human rights! FreePalestine","14",5746
"Tens of thousands people are out in Los Angeles demanding justice for Palestine. Let us be seen. Let Palestinians humanity be seen. All people of good conscience are coming together to say FreePalestine","14",3883
"The events that have unfolded in recent days in Palestine especially the bombings and the martyrdom of the women the children and the men there have wounded peoples hearts. However another part of these events have revealed the incredible power of Islam in Palestine.","14",2680
"Egyptian YouTuber Abdullah Sharif reveals the truth about Palestine. GazaUnderAttack","14",1971
"Israel released pictures of a burntcharred baby that Netanyahu showed the US leader to generate false images to justify its Palestine genocide. Watch this video for more","14",1903
"im jewish and one of the most difficult things ive ever done was deprogram myself from the zionist propaganda i was raised with the atrocities israel have committed and continues to commit against Palestine stand in direct opposition to the values of judaism Free Palestine","14",4490
"BREAKING Labour has banned members and MPs from attending proPalestine protests. The ban was laid out in a letter sent to local parties CLPs by General Secretary David Evans. Labour also banned CLPs from passing motions of solidarity with Palestine Source ","14",2805
"BREAKING ANOTHER MASSACRE IN GAZA 27 killed and 100 others injured in a single Israeli airstrike in Gaza. Another massacre has been commited again refugees in Gaza in the beach area. FREE PALESTINE Gazagenocide NSFW","14",1747
"A real honest Jewish man talks about Israel and the Zionists violation of Palestine in the name of the Jewish religion Gazaunderattack  GazagenocideFreeGaza TheRealImage IsraeliWarCrimes IsrealPalestineconflict Israel","14",2552
"Chicago marches for Gaza and for Palestine. Via","14",3297
"Look how brave these foreign youths are with the Met Police. Its because British police are the most limp wristed virtue signalling police in the world. Israel Palestine","14",3881
"Someone wrote asking  I won't lie to you Ahmed. When I see videos of children being killed and cut in Palestine I recall Quranic verses and hadiths about Allah answering the prayers of the oppressed even if they are nonbelievers. So what about the case of a Muslim","14",2718
"I noticed at least two flags associated with antisemitic terror group Hamas at the Palestine London rally. Inviting support for Hamas and promoting their symbols is illegal in UK. The green Hamas flag with the Islamic creed was next to a black jihadist flag. There was also a","14",2974
"Yesterday terrorists kidnapped  Killed Nigerians in Benue State. But Nigerians are more interested in the conflict between Israel and Palestine.","14",1822
"Unpopular opinion but needs to be said Palestine will benefit more if we fill the Masaajid 5 times a day increase in istighfaar dhikr durood and tilawat rarther than filling the streets with mixed genders and breaking the fundamental principles of our Deen. Rarther pour your","14",4669
"The black flag with the Islamic creed popular with Islamists and jihadists was on display at the London Palestine rally today.","14",2537
"Cuba is an example of true solidarity with Palestine. Hundreds of Palestinians study medicine in Cuba. They say Cuba's example of surviving 60 years of blockade  siege by the most powerful country in the world gives them hope that Palestine too will always live on.","14",4519
"With Gods grace this movement that has started in Palestine will advance and result in a complete victory for the Palestinians. Imam Khamenei Oct. 14 2023","14",3111
"Ya Allah protect our brothers and sisters in Palestine","14",3168
"Arab country allow us to cross border for going Palestine Then see how we treatment them like we did NATO Mohammad Mutmaeen Former head of Afghanistan National Olympic Committee in Kabul. FreeGaza PalestineUnderAttack    Gaza","14",2457
"President of South Africa As predicted with the notable exception of India the Global South is overwhelmingly behind Palestine. And the West overwhelmingly behind Israel. Which means the war will be another major division factor between the West and the rest. Like it or","14",2991
"stop putting dedismemberedinjured bodies on the tl its is NECESSARY to do so. we cannot stay silent about the horrid situation going on in palestine about the thousands of innocent lives being taken WE HAVE TO CONTINUE SPREADING AWARENESS","14",2816
"Emma Rose President ofexplains why the union is standing in solidarity with the people of Palestine today.","14",2227
"A Russian Palestinian influencer Rima Osta talking about whats happening in Gaza. Gazaunderattack Palestine","14",1721
"Its a horrible story what has happened to the Palestinian people. The stats are not lying. Its a literal genocide and has been for many years. Millions are protesting for Palestine around the world these days  They are not Hamas supporters they are fighting for Human","14",2279
"Absolutely huge numbers have turned out in Dublin in solidarity with the Palestinian people. The streets are with Palestine!FreePalestine","14",2669
"In Peshawar tens of thousands attend a rally organised byin support of Palestinian people gaza Palestine israel","14",2575
"I dontknow what is going on in Palestine so imma stay quiet youre seeing a million people post and talk about and choosing not to educate yourself or message anyone posting about it makes you complicit in being part of the problem BTW","14",2927
"Show me the Palestinian flag a global symbol for the struggle of rights freedom and equality! Palestines Ambassador to the UK Husam Zomlot pushes back against British politicians who want to ban waving the Palestinian flag in public.","14",1907
"We believe in the promise of Allah dont be deceived by what you see Allah has only ever spoken the truth to us. May Allah protect our brothers  any where else were the Muslims are being oppressed.","14",2742
"This tweet is addressed to nonArab Twitter users If you don't know the whole truth here's a simple historical summary to clarify things for you The ongoing war between Israel and Palestine is not a war between two states so the attack of the Palestinian resistance is not","14",1584
"Los Angeles says justice for Palestine! FreePalestine","14",3401
"LGBT may stand with Palestine. But Hamasgoverned Gaza by no means stands with LGBT.","14",2623
"A pilgrim praying for Palestine at Masjid alHaram. Palestine palastine FreePalestine FreeGaza    GazzeUnderAttack Gaza Gazagenocide","14",2790
"As part of a group of Palestinians  police. We were nearly pushed down the stairs.","14",2616
"I personally know someone who visited Palestine 15 years ago to visit Masjid Al Aqsa. She was told that the Christians  rape their women break their belongings. They","14",1785
"Palestine Solidarity Campaign confirm 150000 people are in London marching in solidarity with Gaza.","14",2559
"Jewish crowds assemble against Israel in New York NotInOurName Palestine GazaGenocide","14",1956
"Eman is a mother of 4 in palestine My kids and I are not better than those who lost their lives already. Lifetime is equal and our god is one. We will not leave. If we died talk about us tell people that we did not sell our land. I swear with my kids lives that we did not sell","14",1438
"The number of people who died when the building collapsed is uncountable. God will bless the survivors Gazagenocide HamasTerroristIsarael IsraelPalestineConflict IsraeliWarCrimes IsraelTerrorists Palestine GazzeUnderAttack ","14",1849
"Thousands of protesters have gathered in London to show their support for Palestinians organised by groups including Stop the War Coalition and Palestine Solidarity Campaign PSC IsraelHamas war latest","14",2835
"HeartBreaking and Terrifying Israel telling Palestinian to leave certain areas only to ambush them during their exit.  No mainstream media will report it. Zionist Friday the 13th Gaza Palestine   Gazagenocide IsraelTerrorists GazzeUnderAttack ","14",1698
"1947 map issued by National Geographic. There was Palestine but no Israel. Imagine that.","14",1978
" Ireland fans shows their support to Palestine during their game against Greece last night.","14",5725
"not a single humanity  so many childrenwomenmen died lets design a tudung for this. We can give sum of the money to the charity ????? bodo ke bodo","14",2174
"FreePalestine protest update our Legal Observers are reporting arrests  several threatened arrests against protesters wearing keffiyehs. This is the British state suppressing Palestine solidarity and peoples right to protest  pure and simple.","14",1401
"London 150000 people flocked to the streets of London in solidarity with Palestine to tell UK govt that they stand against its support for Israels war crimes. You stepped up. People from all faiths backgrounds  ages united for a FreePalestineGazaGenocide","14",1868
"Nothing less than the reoccupation of Gaza! We make another war and another war and another war and another war! Make Gaza for us! Die Palestine! Boom! Muhammad is dead! I killed him! Fck the Arabs! Fck Muhammad! Meet the children of Israel  my video from","14",1400
"Kicking Off  Palestine Protesters fighting with the police on the streets of Londonmultiple arrests been made","14",1994
"Jeremy Corbyn has backed Sir Keir Starmer into a corner over the IsraelPalestine conflict Millions of people around the world are horrified by Israels actions including Jews Labour was founded on human rights peace and social justice. Starmer has trashed these principles","14",2494
"While I have no love whatsoever for The Tories London controlled by The Labour Party and what has happened there with BLM  his party next year.","14",2764
"our tax dollars fund the airstrikes that burn whole city blocks to the ground and they have a vested interest in manufacturing our consent. we have a responsibility to ensure at the very least that they cannot turn our hearts and minds against Palestine","14",2980
"A proPalestine demonstration in Milano Italy today.","14",1821
