"cleaned_text","created_at","total_interactions_count"
"Fathi Hamad is the Hamas political chief and a member of the Palestinian Legislative Council. His goal is not to free Palestine. It is not to end the occupation. It is not national liberation. It is to shed as much Jewish blood as possible. Period.","17",1687
"NEW 's National Executive Committee have today voted to support Palestine solidarity demonstrations and have agreed to actively promote fundraising for emergency medical aid to Gaza. The union has also called for the halt of UK arms sales to Israel.","17",2138
"Resistance exploding now all over the Palestinian West Bank as news of the genocide on the hospital in Gaza breaks. There'll be no capitulation here to the forces of Israeli fascism. Solidarity with the ppl of Palestine. Gazagenocide FreePalestine","17",2173
"Apparentlyhas called an urgent meeting because hes panicking his position on the IsraelPalestine conflict has done their the party image damage. Because its all about how their image looks of course. A cesspit.","17",2395
"According to U.N. Officials 15 Staff Members of the United Nations Relief and Works Agency for Palestine Refugees UNRWA and 5 Members of the Red Cross have been Killed in the Gaza Strip today.","17",2844
"WATCH Massive proHamas rallies taking over American cities will SHOCK you. This is not footage from Palestine. This is happening in AMERICA.","17",2060
"Does targeting hospitals that are crowded with patients also have anything to do with eliminating armed groups?A new scandal for Israel added to its many scandals regarding the genocide of the defenseless people of Palestine TerrorOfIsrael ","17",1140
"Ya Allah free Palestine from occupation","17",3076
"Arab leaders are rich beyond measure and hold the world's most precious resources. How can they have allowed the world to consider the blood in their peoples veins to become this worthless!? Arab Palestine Gaza","17",1552
"Why do I feel like Hamas is actually working for Israel to clear out the land so Israel can get the entire portion of what was once Palestine? I see Hamas as a controlled proxy group similar to Patriot Front BLM and Antifa in the US. Another Mossad run proxy group is ISIS. Every","17",2495
"While the US media is focused on the GOP trying to elect a new Speaker of the House Israel just bombed a hospital in Gaza with reportedly over 500 people killed already. Free Palestine. End the occupation. Ceasefire now.","17",3389
"Palestine isnt at war with Israel. Israel is actively committing an ethnic cleansing  genocide..","17",1759
"keep spreading the news. keep raising awareness. palestinians need you to keep spreading the word. keep raising your voice. we are doing something even if its the bare minimum so pls dont stop reposting and sharing updates. it helps a lot. Palestine will be free.","17",1285
"Its not about whether you are on team Israel or team Palestine. There is in fact a third option team humanity. A healthy conversation amidst all this horror.","17",1813
"First a lot of people right now are having their personal grief weaponized against Palestine and they are being manipulated in a state of vulnerability. Jewish grief and rage are real right now and the goal isn't to dismiss it it is to rightly aim it at Israel.","17",5955
"Dont dare say Israel is not responsible for the bombs. Palestinian envoy to the United Nations Riyad Mansour addressed the targeting of civilians in Palestines Gaza during a UN Security Council session calling it a breach of international law","17",1267
"A call for a global general strike this Friday for Palestine! Who is joining me??","17",1260
"i'm adding a charity fundraising sticker to my sh0p update ! 100 of profits will go to a trusted emergency fund for Palestine  below FreePalestine","17",1240
"if you can still sit on here and stay silent about palestine now after watching their hospital being bombed then i dont even know what to say","17",1627
"Yemeni tribes declare their readiness to support Palestine.","17",2229
"Israel is in breach of international law3000 Palestinians dead no food no water no medicines no way outall in sight of the International Community. We need ceasefires. We need international law respected. We need peace. Palestine","17",1607
"Thousands of leftists including me were labelled antiSemites  expelled from the Labour Party for supporting Palestine. Is it suddenly not antisemitic to support Palestinians?Answers from Labour MPs who used antisemitism as a weapon against","17",1527
"BREAKING around 1000 students have walked out and protested at Glasgow University in support of Palestine FreePalestine Gaza","17",1434
"As a Muslim  if I can get my way to Palestine right now Ill gladly go and join my brothers and sisters in Islam. Its painful watching all the videos of men women and children murdered by Israeli terrorists","17",2801
"if palestinians are able to have hope for a free palestine in our lifetimewe need to have that same hope and DEMAND it.","17",1724
"It's a really dangerous time where somehow we're being questioned whether it's acceptable to express dissent from a mainstream proIsrael line. Antony Loewenstein Australian German journalist and writer and author of The Palestine Laboratory.","17",1287
"been struggling to find the words but caroline did it perfectly I mourn for Jews and Palestinians alike and am steadfast in my belief that Palestine must be free. the loss of innocent lives has broken my heart and it is unimaginable. a HOSPITAL of innocent people being hit","17",9289
"Do Not Miss It CICwill lead the EFF Picket at the Israeli Embassy in solidarity with the people of Palestine. The continued expansionist policy of ApartheidIsrael state is provocative. The building of settler houses in the land of Palestinian people and","17",1730
"Reckless reporting costs lives. Words can kill. Palestinian ambassador to the UK Husam Zumlot warns the mainstream media about their irresponsible reporting of the IsraelPalestine war. He was speaking at a press conference in London today.","17",1155
"Former Villa and Everton player Anwar ElGhazi has been banned from training and playing in matches by German club Mainz after he supported Palestine on social media Disgraceful.","17",6679
"Look at the hate in his eyes how anyone can not stand with Palestine is completely beyond me.","17",4251
"If Palestine wasn't an ARAB country u would see entire world standing up in support with Palestine but no cuz it's an ARAB country everyone is silent uneducated  stands with wrong side which is Isr. The world is full of hypocrites they called Ukrainians who fought for","17",1560
"NEW Starbucks suing its union after Solidarity With Palestine tweet","17",2209
"Tell me again how ripping down posters of kidnapped Israeli children will free Palestine?","17",2716
"i am going to say this to make it very clear but if youre supporting israel or youre staying neutral whatever that even means you should hard block me theres only one correct side to choose and itll always be advocating for a free palestine","17",1116
"JUST IN  Palestines representative to the United Nations Our goal is to put an end to the massacre against our people in Gaza work to bring in humanitarian aid and not allow the Nakba of 1948 to be repeated. More than 1000 Palestinian children were martyred in Gaza","17",1737
"Mariam went to Palestine to visit family and found herself in the middle of a war zone. Every place I go I run away and I just find bombs and dead people. Maybe one day I will end up like them.","17",1206
"Horrific! Doctors at the Baptist Hospital in Gaza hold a press conference surrounded by the bodies of those slaughtered in the Israeli bombing. Palestine GazaGenocide GazaUnderAttack Gazagenocide","17",863
"Say Palestine one more time... I will kill you. Video footage shows a man threatening UNICEF workers fundraising for Palestine in the Italian city of Milan","17",1036
"Never forget that during the Great Revolt in Palestine 19361939 the UK sent 100k soldiers to torture  Africa was then taught to their Zionist protgs.","17",1288
"Cristiano's sister Katia Aveiro shows support for Palestine on Instagram.","17",5911
"Ya Allah help and grant victory to our brothers and sisters in Palestine.","17",1622
"All these countries finally coming forward and speaking about hows it illegal to bomb a hospital. It took a hospital to be bombed for them to realize Palestine is under genocide and not what Israel has done for the past 70 years.","17",1319
"This is a stark reminder the state of Israel isnt simply at war with Hamas but at war with Palestine  Palestinian men women and children Palestinian Muslims and Christians Palestinian young and old. All of Palestine.","17",1218
"Is Western media's portrayal of the IsraelPalestine conflict biassed?","17",955
"Two of the students who wrote the Harvard letter speak out. They can plaster our faces on trucks. They can make us unemployable. But none of that changes our solidarity with Palestine! BOSTON PALESTINE EVENT VIDEO PREMIERES TODAY!","17",1532
"Is Trusteeship for Palestine the Answer?  Foreign Affairs","17",1635
"Israel receives billions in U.S. military aid and is likely to receive billions more to support its war. The U.S. bears responsibility for the conduct of Israel's war. USE THIS TOOL to tell Congress to call for a ceasefire in Israel  occupied Palestine","17",943
"Biden still hasn't visited East Palestine Ohio as promised but he will go halfway around the world to show support for a fascist occupying force's ongoing genocide.","17",1960
"The brutal massacre against AlAhli Arab Hospital in Gaza in which hundreds of Palestine civilians were murdered must be condemned as a war crime The hospital contained hundreds wounded and forcibly displaced from their homes due to Israeli airstrikes Inhumane  Ceasefire now","17",1302
"for wooyoung birthday in 2021 we donated to palestine children relief fund i would like to ask of atiny to help out once again the palestine children relief fund","17",855
"During my PhD days I had a friend who is from Palestine. He presently works with an international oil company in Middle East. Very intelligent  hardworking. There was a time I met him in the laboratory around midnight shedding tears. I asked him what was wrong. He said that","17",1358
"Bangladesh players celebrating with a Bangladesh flag  a Palestine flag after qualifying to round 2 of FIFA WC Qualifiers.PalestineLivesMatter","17",4152
"Malaysia stand with Palestine foreverfreegaza","17",1674
"Muslim countries are absolutely pathetic they can't be united for a single cause! Shame on all of them. Spinless cowardsPalestine","17",2777
"Palestine is the new BLM. ProPalestine protest in Dallas Texas","17",1829
"Imagine being a doctor and helping save the lives of thousands of Palestinians who are injured under Israeli bombing... And you are surprised to find that your WIFE and FOUR CHILDREN are martyrs in the hospital and you cannot do anything for them unfortunately... Palestine","17",869
"Prayers to Palestine. Please give a little of your time to click this link for help. PalestineWillBeFree","17",1010
"It is absolutely crucial to frame Israel as a settler colonial power it is crucial to quash the false narrative that Palestinians are antisemitic and that Hamas are like nazis. Palestine resists the occupation must end for violence to end and that's it. No more handwringing","17",1452
"Not one penny for the IsraelPalestine conflict until our southern border is closed. Who agrees?","17",1220
"BREAKING Palestine Action throw red paint over the Edinburgh recruiters for Israels biggest weapons producer ShutElbitDown","17",1230
"Extraordinary from !had no idea how to tackle him. A mustwatch for everyone! Palestine Israel","17",1208
"Please help show support to Palestine one click can make a difference and contribute in sending a donation works once every 24 hours if you cant afford to donate please click on this link just once keep Palestine in your prayers FreePalestine","17",706
"Palestinians want to overthrow Mahmoud Abbas president of Palestine","17",1585
"Israel justbombed a Christian hospital full of children and you have some stupid Nigerian Christians applauding this acts of terror because Muslims are supporting Palestine instead of the terrorist state Israel","17",1330
"U.S Killer Get out of Turkey! Allahu Akbar! Protesters have reached the gates of the Korcic base in Turkey's Malatya province where US troops are stationed. Gaza Turkiye Gaza Palestine Gazagenocide GazaGenocide","17",968
"Please everyone don't stop talking about what is happening on palestine! They need us right now since misinformation is going on in social media and people need to know the truth! You don't have to tweet but every every rt helps to keep everyone informed about what is happening!","17",1021
"The Planned Visit tomorrow by U.S. President Biden to the Jordanian Capital of Amman where he would be meeting with the Leaders of Jordan Egypt and Palestine has reportedly now been Cancelled.","17",1836
"losing followers lmao yeah unfollow me if you don't like me speaking for Palestine good for me.","17",1602
"Yall cannot possibly be so sheltered as to believe what happens in Palestine is limited to Palestine after seeing how our government and police forces have been handling Black and brown communities and any yt allies here. Youre in danger if this continues to go uncontested.","17",2058
"Honestly at this point I dont care if I never get commissioned again over my support for Palestine. Personally not interested in writing for media houses who peddle lies and misinformation anyway. If it means the end of journalism for me then so be it.","17",1444
"This video was filmed in Al Ahli Hospital yesterday despite the siege and the bombing they found a space to cheer the kids up. Now they are all mostly gone. Gaza Palestine","17",862
"1.8 billion muslim population in the world 57 muslim countries and none of them is doing anything for their brothers and sisters in Palestine.","17",1201
"for anyone looking for a reliable place to donate to relief in palestine","17",641
"Germany has officially lost it. In fact the West has lost it. Forget about Israel and Palestine for a minute. Tell me Wheres El Ghazis freedom of speech? Wheres Mazraouis freedom of speech? Its ironic how people can burn the Quran publicly because of freedom of speech","17",1398
"Palestine and all oppressed people will see freedom one day. The empire cannot and will not stand.","17",1071
"Because Palestinians belong in Palestine and they want to stay there","17",1696
"I cant believe how many people let Free Palestine be equated wAntisemitism. They are not remotely the same thing. At fucking all. Not only is it a whole ass lie its also incredibly dangerous rhetoric. And were already seeing consequences of that rhetoric spreading.","17",1775
"israel is seriously an ugly vile terrible bitch. free palestine","17",1539
"BLACK SEPTEMBER A DAY OF GENOCIDE OF PALESTINIANS. I've been very vocal on the sufferings of the oppressed people of Palestine. I've equally been vocal on the ongoing deadliest IsraelPalestine conflict through social media platforms. As an addenda to those thoughtprovoking","17",818
"Confrontations between proPalestine protesters and cops in Barcelona now.","17",1152
"In the case of Palestine what the world is seeing is the genocidal crime of the usurping Zionist regime. Imam Khamenei Oct. 17 2023 PalestineGenocide","17",1135
"To the ones fighting disinformation and misinformation related to Palestine we owe you. So many obfuscations and fake accounts that are trying to cover up a massacre","17",1311
". all media should be demanding a ceasefire. All editorial boards should be demanding a ceasefire instead of fomenting genocidal war and aiding and abetting mass atrocities. Gaza Palestine Genocide Freedom Ahli Hospital","17",832
"Words cant ascribe what the heart is feeling right now. This is so devastating to witness Ya Allah! The Most Merciful bring ease upon our brothers and sisters in Palestine","17",970
"They have this fucking playbook perfected. Strike before the eyes of the whole world. Deny loudly. Retract days later when everyones backs are turned. Palestine will not be a footnote for you cowards! We see all your lies.","17",1449
"BREAKING GAZA HOSPITAL BOMBING PROMPTS PROTESTS IN LEBANON AS JORDAN CANCELS SUMMIT WITH PALESTINE  French embassies following the bombing of the Gaza Hospital bombing","17",1392
"NEW Turkey floats the idea to establish a system where regional countries would be security guarantors for Palestine and USEuropean countries for Israel to stop future conflicts Two state solution could be only achieved through this","17",1045
"It would be totally reasonable  justified at this point for other nations to come to the aid of the Palestinians with military support. But the behemoth US war machine has ensured the stakes for that are too high. Washington created a wall so Palestine must resist genocide alone","17",1351
"We do not have to say both sides every time we express solidarity with Palestine. They will still hate and attack you. Also there is NEVER both sides. There is no moral equivalency whatsoever between the occupied battered displaced and their colonizer and butcher.","17",1000
"We need to be very careful with our words when speaking on Palestine. The language oppressors choose to use is intentional. When we think about the fact that ppl in North Gaza was told to evacuate for example. When do WE typically use that term? If theres a danger OUTSIDE OF","17",1262
"Turkish Foreign Minister Hakan Fidan criticises growing disinformation campaigns that have come to the forefront during Israels aggression on Palestine","17",895
"Calling digital volunteers for Palestine! Dedicate your time online by using digital platforms to spread Alkhidmat's relief work in Gaza  show support for the oppressed and displaced people of Palestine. Register here","17",648
"Montreal protest in support of Palestine","17",975
"Separately I have been told the Labour Party leadership are working on a new line on Palestine in light of the significant backlash they have faced. Likely to hear a new stance tomorrow. Many will conclude that it is far too late and irreparable damage has been done.","17",1339
"Anyone not supporting an independentinvestigation on the situation in Palestine right now doesn't actually care about stopping attacks on hospitals. All must be accountable to the law and if you're so sure your chosen side isn't responsible you wouldn't fear it.","17",1038
"The horror and rage the Zionists have provoked in Palestine since Operation AlAqsa Flood does not seem compatible with a return to normalcy. What chance do the Zionists have of ever restoring a peaceful stable status quo in Palestine after this?","17",2204
"The heat is being turned up Biden's visit to Jordan has been cancelled and the fourway summit between the leaders of the USPalestine Egypt and Jordan has also been cancelled after the strike on the AlAhly hospital.","17",1277
"Jordan regime could fall Large and ongoing demonstrations in the Jordanian city of Irbid demanding the opening of the borders with occupied Palestine.","17",1027
"The DSA's Palestine Solidarity working group explicitly endorses violence against Israel Indigenous resistance in all forms are valid whether it be nonviolent protests or armed resistance. The democratic socialists do not promote peace and tolerancethey promote terror.","17",934
"List of brands that support Palestine!","18",89656
"The story of Israel and Palestine in a nutshell.","18",79570
"At the UN Human Rights Committee a huge number of the participants turned their backs on US Ambassador Michelle Taylor in protest against Israel's bombing of Gaza. The shadow of Palestine looms over them.","18",96099
"Athens Greece Thousands march in support of Palestine","18",79095
"Thank you Greece! Today the streets of Athens were filled with people in a powerful show of solidarity with Palestine","18",72797
"I am being told by various sources I am making The Matrix extremely angry with my recent tweets on Palestine  Ive been told that I will pay the price in the endless lawfare battles Im fighting in many different countries. The matrix has attacked me everywhere Im defending my","18",137474
"In a recent viral interview with British TV host Piers Morgan Egyptian comedian and TV personality Bassem Youssef used dark humour to shed light on the ongoing IsraelPalestine war and the hardships faced by Palestinians","18",36915
"Another fun fact to piss you off about the genocide in Palestine the U.S. has spent a total of 233.7 billion adjusted to inflation on Israel. According to the CEO of Hunger Free America it would cost 25 billion to end world hunger in America...","18",51389
"Cant stress how badly we need all players to come out to say this if Zinchenko can stand with Israel without a single punishment then footballers can speak up for Palestine like this.","18",68762
"Apparently its ok to storm the Capitol stage an insurrection inside and interrupt a congressional hearing. But only if youre protesting on behalf of Palestine.","18",45954
"If you're confused about which side to be on There is a global multiracial multifaith popular movement for justice in solidarity with Palestine. There isn't one for Israel.","18",38648
"a nonmuslim who didnt know ANYTHING about this started posted about palestine recently and she told me its bc she saw everyone spreading it and decided to educate herself so she started researching and she learned everything and now she cares so much see what sharing can do?","18",39537
"People lose jobs  money  opportunities for saying Free Palestine  but are praised for saying peace for Israel .. hmmm wonder why?","18",26767
"Also stop making it seem like saying FREE PALESTINE is antisemitic no one has a problem with Jewish people  we stand against the Israeli government  Zionist movement","18",19603
"Israel has been bombing around the AlQuds hospital in Gaza City all day. Now Palestinebased journalistis reporting that individuals INSIDE THE HOSPITAL are being called on to EVACUATE as Israel is planning to bomb the hospital.","18",20576
"If you live in America and cant say Free Palestine without losing your job or fear of social death youre imprisoned too. Let that radicalize you.","18",25813
"people be like I just feel bad for the children like today's palestinian adults weren't yesterday's children that grew up hearing nothing but bombs seeing nothing but death. You're either 100 pro palestine or you're just a zionist.","18",20945
"People are afraid to publicly show support for Palestine for fear of losing their jobs and academic opportunities. I hate to keep repeating this and saying I told you so but the evidence is clear. Yall did not vote out fascism in 2020.","18",33755
"Propagandized man attacks United Nations volunteers raising money for the crisis in Gaza while saying Ill fuing kill you say Palestine one more time!","18",24872
"A thread of reputable charities to donate to who help and provide aid to Palestine","18",11349
"Fuck all the white queers saying uhmm palestine is not queer friendly tho so idc and making this about them","18",31711
"A palestine child once said ","18",18489
"At least X doesnt shadowban posts unlike Instagram. Anything I post related to Palestine gets almost half view compared to my other stories or post.","18",14127
"Allah is with you brother Free Palestine","18",20887
"When people ask what have Palestinians done for insert identity group stop responding with the extensive history of Palestines solidarity because it normalizes the idea that solidarity is a transaction and that victims of a genocide should be cared about for what they give.","18",18392
"We will be organising a Protest Public Meeting against the atrocities in Gaza Palestine. Heads of all political parties  organisations will be invited. No politicalelection speeches will be made. Date 23rd October Time After 6 PM Venue Darussalam Hyderabad","18",21355
"begging white selfobsessed queers to shut up for a moment. palestine doesnt stand with asexuals? goodness me guess its alright their hospitals get ruthlessly bombed and their children indiscriminately killed then.","18",32232
"The world ignorantly thinks that Palestine was empty and completely undeveloped until it was invaded by Israel in 1948! These historical images from 1930 to 1940 shows us that not only Palestine was beautiful but it was highly developed for its time rivaling even the most","18",7720
"You might be struggling to buy groceries pay your mortgage or keep up on your monthly bills. But youll be comforted to know Biden is sending 100 million of YOUR hardearned money to support jihad in Palestine. Biden voters you really effed us all.","18",18335
"Venezuela has just sent a plane with 30 tons of humanitarian aid for the people of Gaza! True solidarity with Palestine against the Israeli war crimes!","18",15715
"JewishAmericans occupy Congress to demand an immediate ceasefire and a free Palestine. Because Jews have always been part of an anti Zionist movement and US support for Israel is not about protecting Jews. Gaza Genocide Ceasefire FreePalestine","18",12984
"Anwar El Ghazi Youcef Atal and other Muslim footballers are getting suspended from their clubs for voicing support for Palestine. Meanwhile Manor Solomon is saying this about the bombing of the AlAhli Baptist Hospital. Once again this has never been about free speech.","18",11796
"the people stand with palestineITS FREE PALESTINIANS UNTIL THEY ARE FREE","18",19051
"When Allah says in the Quran Some faces on that Day will be glowing looking towards their Lord. Al Quraan 752223 I pray that those faces are of the people of Palestine.","18",18177
